url,domain,text,title,date
https://www.cnnindonesia.com/ekonomi/20230120082705-92-902867/harga-emas-antam-terbang-rp10-ribu-ke-rp1039-juta-hari-ini,cnnindonesia.com,"Harga emas PT Aneka Tambang (Persero) alias Antam bertengger di Rp1,039 juta per gram pada Jumat (20/1). Harga emas ini melesat Rp10 ribu dibandingkan Kamis (19/1) kemarin.
Senada, harga pembelian kembali (buyback) naik Rp10 ribu, dari Rp935 ribu menjadi Rp945 ribu per gram.
Berdasarkan data Antam, harga jual emas berukuran 0,5 gram senilai Rp569 ribu, 2 gram Rp2 juta, 3 gram Rp3 juta, 5 gram Rp4,97 juta, 10 gram Rp9,88 juta, 25 gram Rp24,58 juta, dan 50 gram Rp49,09 juta.
Kemudian, harga emas berukuran 100 gram senilai Rp98,11 juta, 250 gram Rp245,01 juta, 500 gram Rp489,82 juta, dan 1 kilogram Rp979,60 juta.
Harga jual emas tersebut sudah termasuk Pajak Penghasilan (PPh) 22 atas emas batangan sebesar 0,45 persen bagi pemegang Nomor Pokok Wajib Pajak (NPWP). Pembeli yang tidak menyertakan NPWP dikenakan potongan pajak lebih tinggi sebesar 0,9 persen.
Sementara itu, harga emas di perdagangan internasional berdasarkan acuan pasar Commodity Exchange COMEX menguat 0,59 persen menjadi US$1.935,2 per troy ons. Sedangkan harga emas di perdagangan spot turun 0,01 persen di US$1.932 per troy ons pada pagi ini.
Senior Analis DCFX Lukman Leong memperkirakan harga emas akan terkerek naik didukung pembelian safe haven di tengah sentimen risk off pasar.
""Pernyataan hawkish akan kenaikan suku bunga dari pejabat The Fed memicu kekhawatiran perlambatan ekonomi yang lebih dalam,"" katanya kepada CNNIndonesia.com.
Hari ini, Lukman memperkirakan harga emas internasional berada dalam rentang support US$1.925 per troy ons dan resistance US$1.950 per troy ons.","Harga Emas Antam Terbang Rp10 Ribu ke Rp1,039 Juta Hari Ini",2023-01-20
https://www.cnnindonesia.com/ekonomi/20210611084043-532-652986/inflasi-as-tembus-level-tertinggi-sejak-2008,cnnindonesia.com,"Inflasi di AS meroket pada periode Mei 2021, mencetak level tertinggi sejak Agustus 2008. Inflasi melonjak 5 persen jika dibandingkan dengan inflasi periode yang sama tahun lalu. Secara bulanan, inflasi tercatat naik 0,6 persen.
Menurut Biro Statistik Tenaga Kerja AS, di luar harga makanan dan energi atau dua komponen yang paling volatil, inflasi tercatat sebesar 3,8 persen atau inflasi tertinggi sejak Juni 1992.
Inflasi inti (core inflation) atau inflasi di luar komponen makanan dan energi tercatat sebesar 0,7 persen, turun dari April yang sebesar 0,9 persen.
Walau inflasi Mei lebih tinggi dari ekspektasi para ekonom, namun Ekonom Economist Intelligence Unit Cailin Birch mengaku tidak kaget.
""Indeks harga konsumen mencapai titik terendah selama krisis virus corona di bulan yang sama tahun lalu. Dikombinasikan dengan pertumbuhan harga yang tinggi baru-baru ini di beberapa area tertentu membuat angka inflasi secara year on year (tahunan) menjadi besar, "" kata Birch dikutip dari CNN Business, Jumat (11/6).
Diproyeksikan tak bakal berlangsung lama, menurut Birch, inflasi akan mereda kembali ke kisaran 2 persen hingga 3 persen pada paruh kedua tahun ini.
Namun, masalah rantai pasokan dan permintaan yang meningkat berpotensi terus mengangkat harga lebih tinggi. Misalnya, harga mobil bekas dan truk lagi-lagi naik tajam 7,3 persen pada Mei. Selama 12 bulan terakhir, harga naik 29,7 persen tanpa penyesuaian musiman.
Pasar mobil bekas laris manis karena beberapa faktor, seperti rendahnya suku bunga bank, persediaan mobil sewaan yang terbatas, kekurangan chip global, serta keengganan pekerja menggunakan transportasi umum turut menyumbang inflasi.
Meskipun kenaikan indeks harga Mei didorong oleh hanya beberapa kategori, tapi tekanan inflasi terlihat di seluruh laporan. Misalnya, perabot rumah tangga, tarif penerbangan, dan biaya pakaian yang naik dengan cepat. Perabotan mencatat kenaikan bulanan terbesar sejak Januari 1976.
Belum lagi masyarakat AS yang kembali makan di restoran saat ekonomi dibuka kembali. Harga dalam kategori 'konsumsi di luar rumah' naik 0,6 persen, laju tercepat sejak September lalu.
Harga makanan restoran mengalami kenaikan karena pengusaha membayar pekerja mereka lebih besar sebagai insentif agar mereka mau kembali bekerja.
Walau jutaan orang tetap menganggur akibat pandemi, para pengusaha melaporkan tantangan menemukan staf yang berkualitas. Berbagai perusahaan menawarkan upah minimum yang lebih tinggi untuk menarik minat pekerja.",Inflasi AS Tembus Level Tertinggi Sejak 2008,2021-06-11
