url,domain,text,title,date
https://www.cnnindonesia.com/ekonomi/20210519084317-78-644075/kekhawatiran-pasar-inflasi-as-naik-tekan-rupiah-ke-rp14295,cnnindonesia.com,"Nilai tukar rupiah berada di level Rp14.295 per dolar AS pada Rabu (19/5) pagi. Posisi tersebut melemah 0,15 persen dibandingkan perdagangan Selasa (18/5) sore di level Rp14.272 per dolar AS.
Pagi ini, mayoritas mata uang di kawasan Asia terpantau melemah terhadap dolar AS. Yen Jepang melemah 0,13 persen, dolar Singapura melemah 0,05 persen, yuan China melemah 0,01 persen, ringgit Malaysia melemah 0,02 persen, bath Thailand melemah 0,06 persen, dan peso Filipina yang terpantau melemah 0,01 persen.
Sebaliknya dolar Taiwan menguat 0,07 persen, won Korea Selatan menguat 0,19 persen, dan rupee India menguat 0,24 persen.
Sementara itu, mata uang di negara maju bergerak bervariasi terhadap dolar AS. Poundsterling Inggris menguat 0,01 persen dan dolar Australia menguat 0,09 persen. Sedangkan dolar Kanada melemah 0,06 persen dan franc Swiss melemah 0,101 persen.
Pengamat pasar keuangan Ariston Tjendra mengatakan rupiah berpotensi melemah hari ini. Pelaku pasar cenderung menghindari aset berisiko terlihat dari pelemahan indeks saham Asia, yang mengekor pelemahan indeks saham AS kemarin.
""Hal ini mungkin bisa menekan nilai tukar rupiah terhadap dolar AS hari ini. Kekhawatiran pasar terhadap kenaikan inflasi di AS mungkin menjadi pemicu aksi hindar risiko,"" ujarnya dalam keterangan tertulis, Rabu (19/5).
Meski demikian, di sisi lain, indeks dolar AS masih terlihat lemah. Pasar masih menganggap Bank Sentral AS tidak akan mengubah kebijakan pelonggaran moneternya dalam waktu dekat karena data tenaga kerja AS yang belum menunjukkan pemulihan seperti sebelum pandemi.
Hal ini kemungkinan bisa menahan pelemahan rupiah tidak terlalu dalam.
""Pelaku pasar menantikan notulen rapat kebijakan moneter AS yang akan dirilis dini hari nanti. Pasar masih ingin mengonfirmasi sikap bank sentral terhadap kenaikan laju inflasi di AS saat ini, apakah ada sinyal pengetatan moneter atau tidak,"" jelasnya.",Kekhawatiran Pasar Inflasi AS Naik Tekan Rupiah ke Rp14.295,2021-05-19
https://www.cnnindonesia.com/ekonomi/20231002125057-92-1006096/bps-beber-dampak-harga-bbm-naik-ke-inflasi-september-2023,cnnindonesia.com,"Plt Kepala Badan Pusat Statistik (BPS) Amalia Adininggar Widyasanti menyebut kenaikan harga BBM nonsubsidi menyumbang inflasi September 2023, meski tidak terlalu signifikan.
Amalia merinci kenaikan harga BBM nonsubsidi pada awal bulan lalu menyumbang 0,06 persen terhadap inflasi September yang menyentuh 0,19 persen secara bulanan (month to month/mtm). Sedangkan inflasi September 2023 secara tahunan (year on year/yoy) berada di level 2,28 persen.
""BBM nonsubsidi pada umumnya dikonsumsi rumah tangga menengah atas, terutama konsumsi alat transportasi pribadi sehingga dampaknya lebih dirasakan pengeluaran rumah tangga tersebut dan dampak lanjutannya tidak terlalu terasa ke pelaku usaha,"" katanya dalam konferensi pers di Kantor BPS, Jakarta Pusat, Senin (2/10).
""Sehingga kalau kita lihat tren inflasi lebih disebabkan faktor lain, bukan karena kenaikan harga BBM nonsubsidi. Jadi, transmisinya relatif terbatas karena BBM nonsubsidi ini hanya dirasakan kelompok masyarakat tertentu saja,"" sambung Amalia.
Di lain sisi, ia menjelaskan dampak kenaikan harga BBM nonsubsidi pada September 2022 lalu yang membuat indeks harga konsumen (IHK) melonjak hingga Agustus 2023. Bahkan, efek kenaikan BBM di tahun ini masih lebih kecil ketimbang dampak lonjakan harga BBM tahun lalu.
Akan tetapi, Amalia mengatakan dampak kenaikan harga BBM di tahun lalu sudah tidak terasa di September 2023 ini.
Amalia merinci penyumbang inflasi September 2023 terbesar secara yoy adalah kelompok makanan, minuman, dan tembakau 2,28 persen. Lalu, diikuti kelompok pakaian dan alas kaki dengan andil inflasi 1,08 persen serta perumahan, air, listrik, dan bahan bakar rumah tangga sebesar 0,05 persen.
""Komponen yang dominan memberikan andil selama setahun terakhir adalah rokok kretek filter, rokok putih, rokok kretek, tarif kereta api, dan tarif air minum PAM. Komoditas yang memberikan andil inflasi selama setahun terakhir adalah beras, bawang putih, daging ayam ras, kentang, dan tahu mentah,"" rinci Amalia.
Sementara itu, komoditas penyumbang inflasi terbesar secara bulanan adalah beras dengan andil 0,18 persen serta bensin sebesar 0,6 persen imbas kenaikan harga BBM nonsubsidi. Ada juga sumbangsih 0,01 persen beberapa komoditas lain, seperti tarif pulsa ponsel; biaya kuliah atau akademik; rokok kretek filter; hingga daging sapi.
Terlepas dari itu, harga BBM nonsubsidi naik lagi di awal Oktober 2023 ini. Kenaikan ini meliputi pertamax, pertamax green 95, pertamax turbo, dexlite, dan pertamina dex.
Harga BBM nonsubsidi Pertamina 1 Oktober di DKI Jakarta
Pertamax: Rp14 ribu (naik Rp700)
Pertamax green 95: Rp16 ribu (naik Rp1.000)
Pertamax turbo: Rp16.600 (naik Rp700)
Dexlite: Rp17.200 (naik Rp850)
Pertamina dex: Rp17.900 (naik Rp1.000)",BPS Beber Dampak Harga BBM Naik ke Inflasi September 2023,2023-10-02
https://www.cnnindonesia.com/ekonomi/20200327094726-92-487388/usai-terbang-harga-emas-kini-stagnan-rp924-ribu-per-gram,cnnindonesia.com,"Jakarta, CNN Indonesia -- Harga jual
emas PT Aneka Tambang (Persero) Tbk atau
Antam berada di posisi Rp924 ribu per gram pada Jumat (27/3) atau stagnan dari Kamis (26/3) pagi. Sementara harga pembelian kembali (
buyback) justru turun Rp2.000 dari Rp837 ribu menjadi Rp835 ribu per gram pada hari ini.
Berdasarkan data Antam, harga jual emas berukuran 0,5 gram senilai Rp486,5 ribu, 2 gram Rp1,79 juta, 3 gram Rp2,67 juta, 5 gram Rp4,44 juta, 10 gram Rp8,81 juta, 25 gram Rp21,93 juta, dan 50 gram Rp43,78 juta. Kemudian, harga emas berukuran 100 gram senilai Rp87,5 juta, 250 gram Rp218,5 juta, 500 gram Rp436,8 juta, dan 1 kilogram Rp873,6 juta.
Harga jual emas tersebut sudah termasuk Pajak Penghasilan (PPh) 22 atas emas batangan sebesar 0,45 persen bagi pemegang Nomor Pokok Wajib Pajak (NPWP). Bagi pembeli yang tidak menyertakan NPWP memperoleh potongan pajak lebih tinggi sebesar 0,9 persen.
ADVERTISEMENT
SCROLL TO CONTINUE WITH CONTENT
Sementara harga emas di perdagangan internasional berdasarkan acuan pasar Commodity Exchange COMEX berada di posisi US$1.649,6 per troy ons atau turun 0,64 persen. Begitu pula harga emas di perdagangan spot melemah 0,44 persen ke US$1.624,16 per troy ons pada pagi ini.
Analis sekaligus Kepala Riset Monex Investindo Ariston Tjendra mengatakan harga emas di pasar internasional berpotensi menguat pada hari ini. Pasalnya, Senat AS telah menyetujui draf aturan pemberian stimulus ekonomi pemerintah AS, meski masih harus menunggu restu dari DPR AS.
Sebelumnya, Presiden AS Donald Trump menjanjikan akan mencairkan anggaran mencapai US$2 triliun untuk mengatasi tekanan ekonomi di Negeri Paman Sam akibat penyebaran pandemi virus corona atau Covid-19. Stimulus fiskal ini melengkapi pelonggaran moneter yang sudah diberikan bank sentral AS, The Federal Reserve.
The Fed memangkas tingkat suku bunga acuan sebesar 100 basis poin (bps) menjadi 0 persen sampai 0,25 persen. The Fed juga membeli surat utang dari sektor keuangan dan korporasi guna menambah kekuatan likuiditas mereka.
""Ini membantu mendorong penguatan harga emas. Harga emas berpotensi bergerak di kisaran US$1.600 sampai US$1.660 per troy ons,"" ungkap Ariston kepada
CNNIndonesia.com.
[Gambas:Video CNN] (uli/sfr)","Usai Terbang, Harga Emas Kini Stagnan Rp924 Ribu per Gram",2020-03-27
https://www.cnnindonesia.com/ekonomi/20220719141458-532-823357/mengenal-inflasi-penyebab-dan-cara-mengatasinya,cnnindonesia.com,"Istilah inflasi tengah menjadi sorotan di masyarakat. Pasalnya, lonjakan inflasi terjadi di banyak negara baik maju maupun berkembang pada Juni ini.
Bahkan, inflasi Amerika Serikat (AS) tembus 9,1 persen. Tingkat inflasi AS itu melampaui ekspektasi para ekonom dan tercatat menjadi yang tertinggi dalam 41 tahun terakhir.
Di dalam negeri sendiri, Badan Pusat Statistik (BPS) mencatat inflasi sebesar 4,35 persen pada Juni 2022 dibanding periode yang sama tahun sebelumnya (year on year/yoy). Inflasi tahunan yang berada di atas 4 persen ini merupakan yang tertinggi sejak 2017 lalu.
Penyebabnya tak lain adalah perang Rusia dan Ukraina. Ketegangan antar dua negara ini menyebabkan lonjakan harga berbagai komoditas dunia terutama minyak dan pangan.
Lantas, apa sebenarnya yang dimaksud dengan inflasi?
Menurut Bank Indonesia (BI), inflasi adalah kenaikan harga barang dan jasa secara umum dan terus menerus dalam jangka waktu tertentu. Sementara itu, menurut Kamus Besar Bahasa Indonesia (KBBI), inflasi adalah kemerosotan nilai uang kertas akibat banyaknya peredaran uang kertas dan kenaikan harga barang.
Sebuah negara disebut inflasi jika kenaikan harga barang terjadi secara meluas akibat kenaikan suatu barang yang memengaruhi barang lain. Sementara kenaikan harga satu atau dua barang tidak dapat disebut inflasi.
Garis besar dari pengertian ini adalah inflasi terjadi karena kenaikan harga barang dan jasa secara meluas yang konsisten dalam waktu cukup panjang sehingga mengacaukan perputaran keuangan serta menyebabkan terjadinya penurunan nilai mata uang.
Apa penyebab inflasi?
Secara umum, inflasi disebabkan oleh ketidakseimbangan permintaan dan penawaran barang atau jasa, peredaran uang, serta biaya produksi. Kondisi ekonomi negara yang menjadi mitra dagang turut berpengaruh terhadap terjadinya inflasi.
Meningkatnya permintaan pasar dalam negeri terhadap suatu jenis barang atau jasa tertentu dalam jumlah besar namun tidak diimbangi dengan pasokan barang yang memadai atau terjadi kelangkaan barang di pasaran.
Biaya produksi yang membengkak disebabkan oleh stok bahan baku yang langka di pasaran. Sementara di waktu yang sama, permintaan akan barang tersebut sangat tinggi.
Harga bahan baku akan menjadi mahal dan biaya produksi harus dinaikkan. Imbasnya, harga jual barang menjadi mahal.
Faktor lain selain kelangkaan bahan baku di pasaran yang menjadi penyebab inflasi adalah naiknya harga bahan bakar dan upah buruh. Dalam situasi tertentu, faktor-faktor tersebut bisa saja naik secara bersamaan.
Banyaknya peredaran uang di masyarakat berimbas pada kenaikan harga barang. Hal ini disebabkan karena pasokan barang yang beredar di pasaran dalam keadaan stagnan, sementara uang yang beredar di masyarakat jumlahnya lebih banyak.","Mengenal Inflasi, Penyebab, dan Cara Mengatasinya",2022-07-19
https://www.cnnindonesia.com/ekonomi/20180724202345-532-316718/cerita-menko-darmin-soal-awal-mula-keperkasaan-dolar-as,cnnindonesia.com,"Jakarta, CNN Indonesia -- Menteri Koordinator Bidang Perekonomian
Darmin Nasution berkisah mengenai keperkasaan
dolar Amerika Serikat (AS) yang belakangan turut menyeret rupiah.
Saat ini, negara-negara dunia termasuk Indonesia bergantung pada dolar AS karena hampir seluruh transaksi internasional menggunakan mata uang ini.
Ia bercerita, AS mengawali dominasi dolar AS pada 1973 dengan meminta Arab Saudi untuk bertransaksi minyak menggunakan mata uang Negera Adidaya tersebut.
ADVERTISEMENT
SCROLL TO CONTINUE WITH CONTENT
Saat itu, mantan Menteri Luar Negeri AS Henry Alfred Kissinger diutus untuk menemui pihak kerajaan Arab Saudi meminta penjualan minyak mentah menggunakan dolar AS.
""Dan Saudi Arabia mau, tidak lama negara-negara teluk lainnya juga mau,"" terang Darmin di Pusdiklat Kementerian Luar Negeri, Jakarta, Selasa (24/7).
Sejak saat itu, kata Darmin, dolar AS diperlukan oleh semua negara. Bahkan, Russia pun membutuhkan dolar AS untuk bertransaksi.
AS telah berhasil menjadikan dolar sebagai mata uang global. Peristiwa itu membuktikan bahwa AS sejak lama paham bahwa mata uangnya penting untuk digunakan secara global.
Alhasil, AS tidak perlu khawatir akan inflasi dengan mencetak mata uangnya dalam jumlah yang banyak. Padahal, negara dunia lainnya harus berhati-hati dalam mencetak uang.
Logikanya, jika uang beredar terlalu banyak di suatu negara dengan tidak diimbangi produksi barang dan jasa, inflasi menjadi tidak terkendali.
""Amerika bisa mencetak uang banyak-banyak tidak inflasi. Kenapa? Karena orang lain perlu juga, bukan cuma negaranya,"" terang Darmin.
Keperkasaan dolar AS saat ini, kata Darmin, diperkuat dengan rencana bank sentralnya menaikan tingkat bunga acuan sebanyak dua kali. Uang di negara-negara berkembang pun 'terambil' ke AS karena imbal hasil
(yield) yang lebih menarik seiring tingkat bunga acuan yang tinggi.
""Dan apa akibatnya? Yang tadinya banyak investor datang ke India, Malaysia, Indonesia, tiba-tiba mulai tarik uangnya untuk apa? Dia mau bawa ke Amerika, karena di sana imbal hasil yield itu dari surat berhaga akan naik,"" terangnya.
(agi)",Cerita Menko Darmin soal Awal Mula Keperkasaan Dolar AS,2018-07-25
https://www.cnnindonesia.com/ekonomi/20180404092153-85-288109/bpk-koreksi-realisasi-subsidi-energi-2016-rp163-triliun,cnnindonesia.com,"Jakarta, CNN Indonesia -- Badan Pemeriksa Keuangan (BPK) memberikan koreksi terhadap pembayaran
subsidi energi tahun anggaran 2016 sebesar Rp1,63 triliun. Hal itu tercantum dalam Ikhtisar Hasil Pemeriksaan (IHPS) Semester II tahun 2017 yang telah diserahkan BPK kemarin kepada Dewan Perwakilan Rakyat.
Koreksi tersebut diberikan setelah BPK melakukan pemeriksaan terhadap pengelolaan subsidi energi tahun anggaran 2016. Pemeriksaan atas pengelolaan subsidi secara umum bertujuan untuk menilai kewajaran perhitungan nilai subsidi yang layak dibayar oleh pemerintah, serta menilai apakah pelaksanaan subsidi telah dilaksanakan sesuai dengan peraturan perundang-undangan yang berlaku.
Objek pemeriksaan terdiri dari subsidi listrik yang dibayarkan kepada PT PLN (Persero), subsidi jenis bahan bakar minyak (BBM) tertentu yang dibayarkan kepada PT Pertamina (Persero) dan PT AKR Corporindo, dan subsidi liquified petroleum gas (LPG) dalam tabung tiga kilogram (kg) yang dibayarkan kepada Pertamina.
ADVERTISEMENT
SCROLL TO CONTINUE WITH CONTENT
Setelah dilakukan koreksi, jumlah subsidi energi yang harus dibayarkan pemerintah kepada badan usaha untuk tahun anggaran 2016 menciut dari Rp93,99 triliun menjadi Rp92,36 triliun.
""Dengan demikian, BPK telah membantu menghemat pengeluarkan negara senilai Rp1,63 triliun dengan mengurangi subsidi yang diajukan BUMN,"" terang BPK seperti dikutip dari IHPS Semester II, Rabu (4/4).
Jika dirinci, koreksi atas pengajuan subsidi listrik PT PLN (Persero) sebesar Rp1,61 triliun, sehingga subsidi yang harus dibayar pemerintah menjadi Rp58,65 triliun. Kemudian, koreksi subsidi sebesar Rp8,08 miliar diberikan untuk subsidi jenis BBM tertentu sehinga pemerintah hanya harus membayar sebesar Rp10,13 triliun. Selanjutnya, subsidi LPG tabung tiga kg mendapatkan koreksi sebesar Rp13,9 miliar menjadi Rp24,18 triliun.
Pemerintah telah membayar subsidi energi 2016 senilai Rp 65,07 triliun. Dengan demikian, pemerintah masih harus menggenapi kekurangan pembayaran subsidi senilai Rp 27,29 triliun yang terdiri dari pembayaran subsidi listrik kepada PLN senilai Rp7,22 triliun, subdisi jenis BBM tertentu kepada Pertamina dan AKR sebesar Rp5,71 triliun, dan subsidi LPG tabung 3 kg sebesar Rp14,35 triliun.
Selain melakukan koreksi subsidi, hasil pemeriksaan atas pengelolaan subsidi menyimpulkan perusahaan belum sepenuhnya merancang dan melaksanakan sistem pengendalian intern secara memadai untuk mencapai tujuan pengendalian, serta belum mematuhi ketentuan peraturan perundang-undangan yang berlaku.
Permasalahan Penghitungan Subsidi ListrikDalam Laporan Hasil Pemeriksaan BPK atas Pemeriksaan dengan Tujuan Tertentu Subsidi Listrik 2016 pada PLN yang dirilis Agustus 2017 lalu, Suparwadi selaku penanggung jawab pemeriksaan mengungkap sejumlah permasalahan yang dapat berpengaruh terhadap perhitungan subsidi listrik periode berikutnya.
Pertama, penyelesaian penghitungan dan pembayaran Biaya Jasa Pengelolaan Sumber Daya Air (BJPSDA) sejak 2013 kepada PT PJTII sebesar Rp233,56 Miliar masih berlarut-larut.
""Kedua, pengadaan
mobile power plant kapasitas 500 megawatt (MW) belum seluruhnya didukung dengan pasokan bahan bakar gas yang berpotensi memboroskan keuangan perusahaan sebesar Rp1,61 triliun dan mengalami keterlambatan,"" ujar Suparwadi.
Selanjutnya, penyusunan Harga Perkiraan Sendiri (HPS) lima unit
Leasing Marine Vessel Power Plant (LMVPP) tidak cermat dan pelaksana pekerjaan belum dikenakan denda keterlambatan minimal sebesar Rp32,79 miliar. Selain itu, pengoperasian pekerjaan tidak didukung dengan sarana dan perencanaan pasokan gas yang memadai.
Berikutnya, permasalahan hukum dan pertanahan pada PLN Transimi Jawa Bagian Tengan (TJBT) yang belum dapat diselesaikan mengganggu kehandalan penyaluran energi listrik.
Terakhir, permasalahan aset tanah seluas 25,14 Hektare senilai Rp1,80 Miliar di UP Saguling PT Indonesia Power (IP) dikuasai oleh pihak lain.
Sehubungan dengan temuan tersebut, BPK merekomendasikan sejumlah kebijakan kepada Direksi PLN.
BPK meminta PLN membuat kajian hukum mengenai kewajiban PLN sebelum melakukan addendum atas tarif BJPSDA, melakukan koordinasi internal PLN dan bersama dengan kementerian terkait untuk mempercepat penyusunan dan penetapan peraturan yang jelas mengenai tarif BJPSDA serta menyelesaikan permasalahan beban BJPSDA sesuai ketentuan yang berlaku.
Kemudian, PLN perlu mempertanggungjawabkan kepada Rapat Umum Pemegang Saham (RUPS) terkait pemborosan atas ketidaksiapan pasokan gas MPP dan ketidakefisienan SFC pembangkit dan melakukan kajian jangka pendek terkait penyediaan pasokan gas atau percepatan penyediaan pasokan gas.
Ketiga, BPK merekomendasikan PLN untuk melakukan negosiasi penurunan harga kontrak pengadaan LMVPP dan memerintahkan Kepala Divisi Operasi Sulawesi Nusa Tenggara dan dan Kepala Divisi Operasi Maluku dan Papua untuk segera mengenakan denda keterlambatan kepada pihak ketiga sebesar Rp32,80 Miliar.
Keempat, PLN perlu memerintahkan seluruh unit PLN untuk melakukan inventarisasi Saluran Udara Tekanan Tinggi (SUTT) dan Saluran Udara Tekanan Menengah (SUTM) di masing-masing unitnya kemudian melaporkan kondisinya kepada Divisi Operasi masing-masing regional, serta membuat rencana tindak lanjut atas kondisi SUTT dan SUTM yang memerlukan perhatian.
PLN juga perlu melakukan koordinasi dengan pihak eksternal antara lain Badan Pertanahan Nasional (BPN) dan Kementerian BUMN untuk menyelesaikan permasalahan tumpang tindih lahan dan melakukan pengukuran ulang bersama-sama sesuai standar BPN untuk lahan seluas 25,14 ha.
(agi)","BPK Koreksi Realisasi Subsidi Energi 2016 Rp1,63 Triliun",2018-04-04
https://www.cnnindonesia.com/ekonomi/20230202122017-90-908048/ragam-penyebab-perubahan-harga-bahan-bakar-minyak-di-indonesia,cnnindonesia.com,"Sosialisasi terkait regulasi perhitungan harga bahan bakar minyak (BBM) dinilai perlu ditingkatkan, juga dilakukan secara masif.
Saat ini, cara perhitungan harga BBM di Indonesia sudah diatur dalam Permen ESDM No.20/2021, yang kemudian diperbarui lewat Permen ESDM No.11/2022 tentang Perhitungan Harga Jual Eceran Bahan Bakar Minyak. Namun, tak banyak masyarakat yang tahu atau memahami alasan harga BBM mudah berubah atau bersifat fluktuatif.
Direktur Eksekutif ReforMiner Institute, Komaidi Notonegoro menyatakan, selama ini masyarakat terbiasa dengan harga BBM yang stabil akibat dari intervensi pemerintah. Padahal, harga minyak mentah sebagai komponen terbesar pembentuk harga BBM di pasar internasional berubah hampir setiap hari.
Menurut Komaidi, perubahan kondisi permintaan dan penawaran minyak Indonesia memperbesar biaya yang diperlukan untuk mengintervensi harga BBM.
""Konsumsi minyak Indonesia telah meningkat dari kisaran 300 ribu barel per hari pada periode awal pelaksanaan pembangunan menjadi sekitar 1,5 juta barel per hari. Sementara kemampuan produksi minyak Indonesia yang sempat mencapai 1,6 juta barel per hari, saat ini turun menjadi 600-700 ribu barel per hari,"" kata Komaidi.
Adapun harga BBM tak hanya ditentukan oleh harga minyak mentah dunia. Komaidi menyebut, nilai tukar rupiah, biaya pengangkutan minyak mentah, pengolahan, penyimpanan BBM, distribusi BBM, hingga tarif pajak dan margin wajar badan usaha terkait pun turut berperan.
""Jika selama ini harga BBM di Indonesia relatif stabil, hal tersebut bukan karena faktor-faktor pembentuk harganya yang stabil, tetapi lebih karena harga BBM diintervensi oleh pemerintah,"" katanya.
Dalam proses penghitungan harga wajar BBM, ada sejumlah faktor penting yang tak dapat diabaikan. Salah satunya, karakteristik minyak mentah dan setting pada kilang minyak yang berpengaruh terhadap produk yang akan dihasilkan, yang bergantung pada crude assay.
Melalui crude assay, dapat diketahui komposisi berbagai produk yang akan dihasilkan, mulai gas, LPG, minyak tanah, bensin, solar, sampai residunya. Sementara, dalam proses pengilangan minyak mentah tidak semuanya jadi BBM, bisa juga dijadikan produk turunan lain.
Komaidi menegaskan, perhitungan harga wajar BBM tak sesederhana yang terlihat, karena ada penghitungan hasil produk lain yang harganya juga tak sama. Hal itu belum termasuk struktur biaya penyediaan BBM yang berbeda antar negara.
""Secara umum struktur harga BBM terbagi menjadi tiga komponen utama, yaitu biaya minyak mentah, keuntungan badan usaha, dan pajak. Komponen terbesar umumnya terdistribusi untuk biaya minyak mentah dan pajak,"" tutur Komaidi.
Regulasi di Indonesia menentukan, harga eceran jenis BBM Subsidi/Tertentu ditetapkan dengan formula harga dasar ditambah Pajak Pertambahan Nilai (PPN), dikurangi subsidi, dan ditambah Pajak Bahan Bakar Kendaraan Bermotor (PBBKB).
Sementara untuk harga eceran BBM Khusus Penugasan (JBKP) ditetapkan melalui formula harga dasar ditambah biaya tambahan pendistribusian di wilayah penugasan sebesar Rp90, ditambah Pajak Pertambahan Nilai (PPN), dan ditambah Pajak Bahan Bakar Kendaraan Bermotor (PBBKB).
Selain mengatur harga eceran BBM Subsidi dan JBKP, negara juga mengatur harga eceran jenis BBM Umum yang dihitung dan ditetapkan berdasarkan formula harga tertinggi. Formula itu terdiri atas harga dasar, ditambah Pajak Pertambahan Nilai (PPN), Pajak Bahan Bakar Kendaraan Bermotor (PBBKB), dan margin usaha paling tinggi 10 persen dari harga dasar.
Selanjutnya, harga dasar BBM memiliki rumusan yang terdiri dari biaya perolehan, distribusi, penyimpanan, dan margin. Setiap bulan, dilakukan penghitungan harga dasar menggunakan rata-rata harga indeks pasar dan nilai tukar rupiah terhadap dollar Amerika dengan kurs beli Bank Indonesia.
Karena sifat fluktuatif tersebut, Komaidi menganggap perubahan harga BBM merupakan hal yang wajar, sama seperti perubahan harga barang dan jasa pada umumnya. Hal penting lain yang perlu diawasi adalah penerapan mekanisme penyesuaian harga yang adil untuk semua pihak.
""Ketika biaya penyediaan turun, harga BBM harus diturunkan agar tidak merugikan konsumen. Sebaliknya, ketika biaya penyediaan naik, harga BBM harus dinaikkan agar tidak merugikan pelaku usaha penyedia BBM,"" kata Komaidi.
(rea)",Ragam Penyebab Perubahan Harga Bahan Bakar Minyak di Indonesia,2023-02-02
https://www.cnnindonesia.com/ekonomi/20220922153206-92-851336/harga-emas-antam-melambung-ke-rp941-ribu-usai-fed-naikkan-suku-bunga,cnnindonesia.com,"Harga emas PT Aneka Tambang (Persero) alias Antam bertengger di level Rp941 ribu per gram pada Jumat (23/9). Harga itu naik Rp4.000 dibandingkan Kamis (22/9) kemarin.
Begitu juga dengan harga pembelian kembali yang naik Rp4.000 menjadi Rp809 ribu per gram.
Berdasarkan data Antam, harga jual emas berukuran 0,5 gram senilai Rp520 ribu, 2 gram Rp1,82 juta, 3 gram Rp2,7 juta, 5 gram Rp4,48 juta, 10 gram Rp8,9 juta, 25 gram Rp22,13 juta, dan 50 gram Rp44,19 juta.
Kemudian, harga emas seberat 100 gram senilai Rp88,31 juta, 250 gram Rp220,51 juta, 500 gram Rp440,82 juta, dan 1 kilogram Rp881,6 juta.
Harga jual emas tersebut sudah termasuk Pajak Penghasilan (PPh) 22 atas emas batangan sebesar 0,45 persen bagi pemegang Nomor Pokok Wajib Pajak (NPWP). Sedangkan, pembeli yang tidak menyertakan NPWP dikenakan potongan pajak lebih tinggi sebesar 0,9 persen.
Sementara itu, harga emas di perdagangan internasional berdasarkan acuan pasar Commodity Exchange COMEX menguat 0,13 persen menjadi US$1.683,3 per troy ons. Begitu juga dengan harga emas di perdagangan spot yang menguat 0,13 persen ke US$1.673,44 per troy ons pada pagi ini.
Analis PT Sinarmas Futures Ariston Tjendra memproyeksi harga emas internasional berbalik arah tertekan hari ini. Sebab, The Fed masih agresif mengerek suku bunga acuan hingga akhir tahun.
""Kebijakan The Fed yang agresif masih akan menekan harga emas spot,"" ucap Ariston kepada CNNIndonesia.com.
Menurut dia, harga emas akan bergerak dalam rentang support US$1.650-US$1.660 per troy ons dan resistance US$1.686 per troy ons.",Harga Emas Antam Melambung ke Rp941 Ribu Usai Fed Naikkan Suku Bunga,2022-09-23
