url,domain,title,date,clean_text
https://ekonomi.republika.co.id/berita/t5jwfm423/emas-ubsgaleri24-di-pegadaian-selasa-ini-kompak-melonjak,ekonomi.republika.co.id,Emas UBS-Galeri24 di Pegadaian Selasa Ini Kompak Melonjak |Republika Online,2025-11-11,"harga emas yang dikutip dari laman resmi sahabat pegadaian, selasa (11/11/2025), menunjukkan dua produk logam mulia yakni buatan ubs dan galeri24 kompak mengalami lonjakan harga jual.

harga jual emas galeri24 naik menjadi rp2.400.000 dari sebelumnya rp2.378.000 per gram.

begitu pula emas ubs yang turut melonjak ke rp2.409.000 dari semula dibanderol rp2.381.000 per gram.

emas galeri24 dijual dengan kuantitas mulai 0,5 gram hingga 1.000 gram atau 1 kilogram, sementara emas ubs dijual dalam rentang 0,5 gram hingga 500 gram.

berikut daftar lengkap harga emas masing-masing produk: harga emas ubs: - 0,5 gram: rp1.302.000 - 1 gram: rp2.409.000 - 2 gram: rp4.781.000 - 5 gram: rp11.814.000 - 10 gram: rp23.502.000 - 25 gram: rp58.639.000 - 50 gram: rp117.036.000 - 100 gram: rp233.979.000 - 250 gram: rp584.776.000 - 500 gram: rp1.168.180.000 harga emas galeri24: - 0,5 gram: rp1.259.000 - 1 gram: rp2.400.000 - 2 gram: rp4.729.000 - 5 gram: rp11.735.000 - 10 gram: rp23.407.000 - 25 gram: rp58.374.000 - 50 gram: rp116.657.000 - 100 gram: rp233.198.000 - 250 gram: rp579.287.000 - 500 gram: rp1.158.574.000 - 1.000 gram: rp2.317.147.000."
https://news.republika.co.id/berita/srt9j1366/pastikan-stok-pangan-tersedia-jaksel-siapkan-pasar-murah-jelang-ramadhan,news.republika.co.id,"Pastikan Stok Pangan Tersedia, Jaksel Siapkan Pasar Murah Jelang Ramadhan |Republika Online",2025-02-17,"suku dinas perindustrian, perdagangan, koperasi, usaha kecil dan menengah (ppkukm) kota administrasi jakarta selatan menyiapkan pasar murah menjelang ramadhan 1446 hijriyah untuk memastikan stok bahan pangan tersedia bagi masyarakat.

""kami mengadakan bazar atau pasar murah menjelang bulan ramadhan untuk membantu masyarakat mendapatkan kebutuhan pokok dengan harga terjangkau,"" kata kepala seksi koperasi dan ukm suku dinas (sudin) ppkukm jakarta selatan edi margono saat dihubungi, senin (17/2/2025).

edi mengatakan nantinya harga di pasar murah diupayakan tak jauh dari harga yang ada di pasaran agar bisa mudah dijangkau masyarakat.

dia berharap program ini berkelanjutan demi bisa memberdayakan pedagang umkm dan koperasi terutama pada penjualan sembako.

program ini juga menjadi peluang bagi umkm dan koperasi untuk meningkatkan penjualan produk mereka, baik sembako, makanan khas ramadhan maupun produk lainnya.

pada 2025 ini, pihaknya juga akan memperluas jaringan kemitraan dengan berbagai perusahaan swasta, bumn maupun perusahaan rintisan (startup) dalam berbagai bidang.

""berbagai bidang itu seperti program tanggung jawab sosial perusahaan (corporate social responsibility/csr), pelatihan umkm, penyediaan modal usaha hingga distribusi produk umkm ke ritel modern atau platform digital,"" ujarnya.

ke depannya, pemerintah kota administrasi jakarta selatan juga merapikan dan mempercantik area pedagang kaki lima (pkl) dengan konsep beautifikasi.

diharapkan dengan adanya beautifikasi mampu menciptakan lingkungan yang lebih tertata, bersih dan nyaman bagi pedagang serta pembeli.

""upaya ini dapat mencakup penggunaan tenda atau gerobak seragam, zona pkl tematik, serta integrasi dengan ruang terbuka hijau dan fasilitas umum lainnya,"" ujarnya.

pemerintah provinsi (pemprov) dki jakarta memprediksi saat ramadhan dan idul fitri 1446 hijriyah daging sapi merupakan komoditas yang mengalami peningkatan permintaan paling tinggi di masyarakat, yakni mencapai 17,38 persen dari kebutuhan normal.

kepala dinas ketahanan pangan, kelautan, dan pertanian (kpkp) dki jakarta suharini eliawati mengatakan permintaan komoditas ini naik sebanyak 1.028 ton dari kebutuhan normal 5.901 ton per bulan."
https://ekonomi.republika.co.id/berita/srt51b490/jauhi-level-rp-17-juta-per-gram-harga-emas-turun-hari-ini,ekonomi.republika.co.id,"Jauhi Level Rp 1,7 Juta per Gram, Harga Emas Turun Hari Ini |Republika Online",2025-02-17,"harga emas antam yang dipantau dari laman logam mulia, senin (17/2/2025), turun sebesar rp 7.000 dari sebelumnya di angka rp 1.678.000 per gram.

sehingga harga logam mulia tersebut kini menjadi rp 1.671.000 per gram.

harga jual kembali (buyback) emas batangan turut turun, yakni rp 1.521.000 per gram.

transaksi harga jual dikenakan potongan pajak, sesuai dengan pmk no.

34/pmk.10/2017.

penjualan kembali emas batangan ke pt antam tbk dengan nominal lebih dari rp 10 juta, dikenakan pajak penghasilan (pph) pasal 22 sebesar 1,5 persen untuk pemegang nomor pokok wajib pajak (npwp) dan 3 persen untuk non-npwp.

pph 22 atas transaksi buyback dipotong langsung dari total nilai buyback.

berikut harga pecahan emas batangan yang tercatat di laman logam mulia antam pada senin (17/2/2025): - harga emas 0,5 gram: rp 885.500.

- harga emas 1 gram: rp 1.671.000.

- harga emas 2 gram: rp 3.282.000.

- harga emas 3 gram: rp 4.898.000.

- harga emas 5 gram: rp 8.130.000.

- harga emas 10 gram: rp 16.205.000.

- harga emas 25 gram: rp 40.387.000.

- harga emas 50 gram: rp 80.695.000.

- harga emas 100 gram: rp 161.312.000.

- harga emas 250 gram: rp 403.015.000.

- harga emas 500 gram: rp 805.820.000.

- harga emas 1.000 gram: rp 1.611.600.000.

potongan pajak harga beli emas sesuai dengan pmk nomor 34/pmk.10/2017, pembelian emas batangan dikenakan pph 22 sebesar 0,45 persen untuk pemegang npwp dan 0,9 persen untuk non-npwp.

setiap pembelian emas batangan disertai dengan bukti potong pph 22."
https://ekonomi.republika.co.id/berita/sxb86h490/harga-emas-turun-pada-4-juni-2025-ini-detailnya,ekonomi.republika.co.id,"Harga Emas Turun pada 4 Juni 2025, Ini Detailnya |Republika Online",2025-06-04,"harga emas batangan produksi pt antam tbk yang dipantau dari laman resmi logam mulia pada rabu (4/6/2025), tercatat mengalami penurunan sebesar rp 16.000 per gram.

harga yang sebelumnya berada di level rp 1.940.000 kini menjadi rp 1.924.000 per gram.

seiring penurunan harga jual, harga jual kembali (buyback) emas batangan juga turun menjadi rp 1.768.000 per gram.

transaksi jual beli emas dikenakan potongan pajak sesuai ketentuan peraturan menteri keuangan (pmk) nomor 34/pmk.10/2017.

penjualan kembali emas batangan ke antam dengan nominal di atas rp 10 juta dikenakan pajak penghasilan (pph) pasal 22 sebesar 1,5 persen bagi pemegang nomor pokok wajib pajak (npwp), dan 3 persen bagi non-npwp.

potongan pph 22 dipotong langsung dari total nilai buyback.

berikut rincian harga emas batangan yang tercatat di laman logam mulia antam per rabu (4/6/2025): 0,5 gram: rp 1.012.000 1 gram: rp 1.924.000 2 gram: rp 3.788.000 3 gram: rp 5.657.000 5 gram: rp 9.395.000 10 gram: rp 18.735.000 25 gram: rp 46.712.000 50 gram: rp 93.345.000 100 gram: rp 186.612.000 250 gram: rp 466.265.000 500 gram: rp 932.320.000 1.000 gram: rp 1.864.600.000 sementara itu, untuk pembelian emas batangan juga dikenakan pph 22 sebesar 0,45 persen bagi pemilik npwp dan 0,9 persen bagi non-npwp.

setiap transaksi pembelian akan disertai bukti potong pph 22."
https://analisis.republika.co.id/berita/t21dv8451/bulog-dan-ikhtiar-besar-swasembada-pangan,analisis.republika.co.id,Bulog dan Ikhtiar Besar Swasembada Pangan |Republika Online,2025-09-04,"oleh entang sastraatmadja ketua dewan pakar dpd hkti jawa barat republika.co.id, jakarta - presiden prabowo subianto selalu menekankan indonesia merupakan negara dengan tanah yang subur.

apa saja yang ditanam, pasti akan tumbuh dan menghasilkan.

karena itulah, harus banyak tanaman pangan, khususnya yang menghasilkan makanan pokok seperti beras.

sekitar empat dekade lalu, indonesia merajai produksi beras di asia tenggara.

swasembada beras indonesia kala itu terbaik di asean, mengungguli thailand, myanmar, laos, malaysia, kamboja, dan lainnya.

produksi padi nasional indonesia pada awal dekade 1980-an, didorong oleh program revolusi hijau, meningkat dari sekitar 29,65 juta ton gabah kering giling (gkg) pada tahun 1980 menjadi 32,77 juta ton gkg setahun kemudian.

angka ini terus menunjukkan tren positif sepanjang dekade tersebut, ditandai dengan pencapaian swasembada beras pada tahun 1984 dan penerimaan penghargaan dari organisasi pangan dan pertanian dunia (fao) pada tahun 1985.

namun setelah itu, indonesia tak lagi menjadi yang terbaik.

kemunduran itu berlangsung lama, hingga akhirnya pada masa presiden prabowo memimpin indonesia berupaya mengulang kejayaan masa lalu.

badan pusat statistik (bps) melaporkan produksi beras nasional hingga oktober 2025 diperkirakan mencapai 31,04 juta ton.

angka ini melampaui kebutuhan konsumsi nasional yang pada periode yang sama diperkirakan sebesar 27,3 juta ton.

dengan capaian ini, indonesia mencatat surplus produksi beras sekitar 3,7 juta ton.

peran bulog panen raya padi musim tanam oktober-maret 2025 telah usai, dan kini kita bersiap menyambut panen raya berikutnya untuk musim tanam april-september 2025.

di tengah dinamika pangan nasional, perum bulog patut berbangga karena berhasil mencatatkan capaian signifikan.

sebagai operator pangan pemerintah, bulog telah menunjukkan kinerja terbaiknya dengan menyerap gabah lebih dari 2 juta ton, sebuah pencapaian yang melonjak tajam dibandingkan rerata penyerapan lima tahun terakhir yang hanya berkisar antara 1 hingga 1,2 juta ton.

keberhasilan ini tidak hanya menjadi indikator capaian kerja bulog, tetapi juga sebuah langkah penting dalam mendukung program swasembada pangan yang dicanangkan pemerintah.

peran bulog dalam menjaga stabilitas pangan dan meningkatkan kesejahteraan petani semakin terlihat nyata melalui lima fungsi strategisnya.

pertama, bulog berperan penting dalam melakukan penyerapan gabah dan beras dari petani dalam negeri.

hal ini berdampak langsung pada kesejahteraan petani sekaligus memastikan ketersediaan pangan nasional.

dengan target penyerapan sekitar 3 juta ton untuk tahun 2025, langkah ini diharapkan menjadi penyangga utama ketahanan pangan nasional.

kedua, bulog menjalankan pembelian gabah dengan harga yang telah ditetapkan pemerintah, yakni rp6.500 per kilogram untuk gabah kering panen (gkp).

harga yang kompetitif ini diharapkan memberikan insentif positif bagi petani untuk terus meningkatkan produktivitas dan kualitas hasil panen mereka."
https://ekonomi.republika.co.id/berita/szksow502/harga-emas-turun-hari-ini-tapi-cuma-rp2000,ekonomi.republika.co.id,Harga Emas Turun Hari Ini! Tapi Cuma Rp2.000 |Republika Online,2025-07-18,"harga emas antam yang dipantau dari laman logam mulia di jakarta, jumat (18/7), mengalami penurunan rp2.000 dari semula rp1.919.000 menjadi rp1.917.000 per gram.

namun, harga jual kembali (buyback) emas batangan tetap stabil di rp1.763.000 per gram.

transaksi harga jual dikenakan potongan pajak, sesuai dengan pmk nomor 34/pmk.10/2017.

penjualan kembali emas batangan ke pt antam tbk dengan nominal lebih dari rp10 juta, dikenakan pajak penghasilan (pph) pasal 22 sebesar 1,5 persen untuk pemegang nomor pokok wajib pajak (npwp) dan 3 persen untuk non-npwp.

pph 22 atas transaksi buyback dipotong langsung dari total nilai buyback.

berikut harga pecahan emas batangan yang tercatat di laman logam mulia antam pada jumat: - harga emas 0,5 gram: rp1.008.500.

- harga emas 1 gram: rp1.917.000.

- harga emas 2 gram: rp3.774.000.

- harga emas 3 gram: rp5.636.000.

- harga emas 5 gram: rp9.360.000.

- harga emas 10 gram: rp18.665.000.

- harga emas 25 gram: rp46.537.000.

- harga emas 50 gram: rp92.995.000.

- harga emas 100 gram: rp185.912.000.

- harga emas 250 gram: rp464.515.000.

- harga emas 500 gram: rp928.820.000.

- harga emas 1.000 gram: rp1.857.600.000.

potongan pajak harga beli emas sesuai dengan pmk nomor 34/pmk.10/2017, pembelian emas batangan dikenakan pph 22 sebesar 0,45 persen untuk pemegang npwp dan 0,9 persen untuk non-npwp.

setiap pembelian emas batangan disertai dengan bukti potong pph 22."
https://ekonomi.republika.co.id/berita/t58fq9423/harga-emas-antam-turun-jadi-rp226-juta-per-gram-buyback-ikut-melemah,ekonomi.republika.co.id,"Harga Emas Antam Turun Jadi Rp2,26 Juta per Gram, Buyback Ikut Melemah |Republika Online",2025-11-05,"harga emas antam yang dipantau dari laman logam mulia di jakarta, rabu, mengalami penurunan sebesar rp26.000 menjadi rp2.260.000 dari sebelumnya rp2.286.000 per gram.

untuk harga jual kembali (buyback), turut turun ke angka rp2.125.000 dari sebelumnya rp2.151.000 per gram.

emas antam dijual mulai dari gramasi 0,5 gram hingga 1 kilogram (1.000 gram).

transaksi harga jual dikenakan potongan pajak sesuai dengan peraturan menteri keuangan (pmk) nomor 34/pmk.10/2017.

penjualan kembali emas batangan ke pt antam tbk dengan nominal lebih dari rp10 juta dikenakan pajak penghasilan (pph) pasal 22 sebesar 1,5 persen untuk pemegang nomor pokok wajib pajak (npwp) dan 3 persen untuk non-npwp.

pph 22 atas transaksi buyback dipotong langsung dari total nilai buyback.

berikut harga pecahan emas batangan yang tercatat di laman logam mulia antam pada rabu: - emas 0,5 gram: rp1.180.000 - emas 1 gram: rp2.260.000 - emas 2 gram: rp4.460.000 - emas 3 gram: rp6.665.000 - emas 5 gram: rp11.075.000 - emas 10 gram: rp22.095.000 - emas 25 gram: rp55.112.000 - emas 50 gram: rp110.145.000 - emas 100 gram: rp220.212.000 - emas 250 gram: rp550.265.000 - emas 500 gram: rp1.100.320.000 - emas 1.000 gram: rp2.200.600.000 potongan pajak untuk pembelian emas juga mengikuti ketentuan pmk nomor 34/pmk.10/2017.

pembelian emas batangan dikenakan pph 22 sebesar 0,45 persen untuk pemegang npwp dan 0,9 persen untuk non-npwp.

setiap pembelian emas batangan disertai dengan bukti potong pph 22."
https://ekonomi.republika.co.id/berita/t386wr328/emas-antam-sabtu-ini-meroket-rp-16-ribu-per-gram,ekonomi.republika.co.id,Emas Antam Sabtu Ini Meroket Rp 16 Ribu per Gram |Republika Online,2025-09-27,"harga emas antam yang dipantau dari laman logam mulia, sabtu (27/9/2025), mengalami lonjakan.

harganya naik rp 16.000 dari semula rp 2.175.000 menjadi rp 2.191.000 per gram.

untuk harga jual kembali (buyback) menjadi rp2.038.000 per gram.

untuk penjualan kembali emas batangan ke pt antam tbk dengan nominal lebih dari rp 10 juta, dikenakan pajak penghasilan (pph) pasal 22 sebesar 1,5 persen untuk pemegang nomor pokok wajib pajak (npwp) dan 3 persen untuk non-npwp.

pph 22 atas transaksi buyback dipotong langsung dari total nilai buyback.

berikut harga pecahan emas batangan yang tercatat di laman logam mulia antam pada sabtu: - harga emas 0,5 gram: rp 1.145.500.

- harga emas 1 gram: rp 2.191.000.

- harga emas 2 gram: rp 4.322.000.

- harga emas 3 gram: rp6.458.000.

- harga emas 5 gram: rp 10.730.000.

- harga emas 10 gram: rp 21.405.000.

- harga emas 25 gram: rp53.387.000.

- harga emas 50 gram: rp 106.695.000.

- harga emas 100 gram: rp 213.312.000.

- harga emas 250 gram: rp 533.015.000.

- harga emas 500 gram: rp 1.065.820.000.

- harga emas 1.000 gram: rp 2.131.600.000.

potongan pajak harga beli emas sesuai dengan pmk nomor 34/pmk.10/2017, pembelian emas batangan dikenakan pph 22 sebesar 0,45 persen untuk pemegang npwp dan 0,9 persen untuk non-npwp.

setiap pembelian emas batangan disertai dengan bukti potong pph 22."
https://news.republika.co.id/berita/sr9g0n484/menko-ahy-upayakan-turunkan-tiket-pesawat-saat-lebaran-2025,news.republika.co.id,Menko AHY Upayakan Turunkan Tiket Pesawat Saat Lebaran 2025 |Republika Online,2025-02-06,"menteri koordinator bidang infrastruktur dan pembangunan kewilayahan (menko ipk), agus harimurti yudhoyono (ahy) mengupayakan agar tiket pesawat saat lebaran 2025 dapat turun.

dengan tiket turun maka harganya terjangkau oleh masyarakat yang mudik, sepertinya saat natal 2024 dan tahun baru 2025.

""keinginan kita semua (penurunan tiket).

masih kita upayakan.

kita koordinasikan dengan pihak-pihak terkait,"" kata ahy dalam keterangannya di jakarta, kamis (6/2/2025).

ahy pun mendorong seluruh jajaran dan kementerian teknis terkait bekerja keras untuk mewujudkan harapan dari masyarakat tersebut.

""waktu itu baru saja kita dilantik tapi sudah langsung masuk ke masa-masa penyiapan nataru dan alhamdulillah pas natal dan tahun baru, bisa turun rata-rata 10 persen.

mohon doanya agar kita bisa mendapatkan solusi terbaik bagi semua pihak,"" katanya.

sebelumnya menko ahy mengungkapkan, penurunan harga tiket pesawat merupakan kebijakan yang prorakyat.

ahy menyoroti kemungkinan penurunan harga tiket angkutan umum seperti yang berhasil diterapkan pada periode natal 2024 dan tahun baru 2025 dalam rapat koordinasi (rakor) persiapan lebaran.

dengan tren mobilitas masyarakat yang terus meningkat pascapandemi covid-19, rakor persiapan lebaran menjadi penting untuk mengantisipasi tantangan yang mungkin muncul.

ahy menegaskan, pentingnya koordinasi yang kuat di semua lini guna memastikan kelancaran arus mudik dan balik pada lebaran tahun ini.

badan pusat statistik (bps) menyebut, kenaikan jumlah penumpang pada seluruh moda transportasi baik udara, keret, maupun angkutan laut pada desember 2024 didorong oleh penurunan harga tiket pesawat dan juga potongan harga.

hal itu menjadi bukti diskon tarif pesawat disambut masyarakat."
https://ekonomi.republika.co.id/berita/t10xqf370/stok-beras-melimpah-harga-tetap-tinggi-ini-penjelasan-bulog,ekonomi.republika.co.id,"Stok Beras Melimpah, Harga Tetap Tinggi? Ini Penjelasan Bulog |Republika Online",2025-08-15,"perum bulog merespons isu stok beras nasional yang melimpah namun harga di pasar tetap tinggi.

direktur utama perum bulog, achmad rizal ramdhani menjelaskan sebagian besar stok beras di indonesia saat ini berada di tangan pelaku usaha swasta.

""porsi yang berada di bawah kendali pemerintah hanya sekitar empat juta ton atau setara delapan persen dari total produksi beras nasional yang diperkirakan mencapai 35 juta ton,"" ujar rizal dalam keterangan tertulis di jakarta, jumat (15/8/2025).

rizal menyampaikan keterbatasan penguasaan stok oleh pemerintah menjadi faktor utama dalam efektivitas pengendalian harga.

dengan porsi hanya delapan persen, ucap rizal, ruang gerak intervensi pemerintah menjadi terbatas.

""namun bulog memastikan setiap butir beras yang kami kelola digunakan secara strategis untuk menjaga stabilitas harga dan melindungi daya beli masyarakat,"" lanjut rizal.

meski bulogo hanya menguasai sekitar delapan persen dari produksi nasional, ucap rizal, bulog adalah badan usaha dengan pemilik stok beras terbesar di indonesia dan jaringan distribusi terluas hingga pelosok daerah, melalui pasar tradisional, ritel modern, outlet rumah pangan kita (rpk), dan mitra distribusi lainnya.

dengan begitu, rizal meyakini bulog dapat berperan melakukan intervensi pasar untuk melakukan stabilisasi harga apabila gejolak harga tidak stabil.

hingga pertengahan agustus 2025, sambung dia, bulog telah menyalurkan beras stabilisasi pasokan dan harga pangan (sphp) ke seluruh provinsi melalui operasi pasar, pasar tradisional, dan jaringan ritel modern.

rizal menyebut upaya ini dilakukan secara masif untuk menekan kenaikan harga di tingkat konsumen.

""bulog juga terus berkoordinasi dengan kementerian terkait, pemerintah daerah, dan pelaku usaha pangan untuk memastikan ketersediaan beras tetap terjaga, khususnya menjelang periode konsumsi tinggi,"" kata rizal.

dengan langkah-langkah ini, rizal sampaikan, pemerintah berharap masyarakat dapat melihat kestabilan harga tidak hanya ditentukan oleh jumlah stok nasional, tetapi juga oleh distribusi penguasaan stok dan dinamika pasar yang melibatkan banyak pihak."
https://news.republika.co.id/berita/ss2lhu458/jelang-ramadhan-menko-polkam-jamin-harga-pangan-stabil,news.republika.co.id,"Jelang Ramadhan, Menko Polkam Jamin Harga Pangan Stabil |Republika Online",2025-02-22,"menjelang ramadhan 1446 h, pemerintah memastikan pengendalian harga pangan utama.

menteri koordinator bidang politik dan keamanan (menko polkam) budi gunawan mengatakan, seluruh kementerian akan berkolaborasi tidak hanya untuk mengawasi harga pangan di pasaran, tetapi juga menggelar operasi pasar di tengah masyarakat.

menurut dia, hal itu dilakukan pula selama bulan puasa hingga hari raya idul fitri 1446 h.

""sehingga masyarakat tetap mendapatkan harga di bawah het (harga eceran tertinggi), seperti yang disampaikan bapak presiden prabowo subianto,"" kata menko polkam budi gunawan dalam keterangan pers, sabtu (22/2/2025).

sebagai contoh, untuk minyak goreng minyakita, pemerintah telah menetapkan het sebesar rp 15.700 per liter.

menko polkam mengakui, kini angka realisasi jual produk tersebut sebesar rp17.500 atau melebihi het.

oleh karena itu, lanjut dia, presiden prabowo subianto telah memerintahkan kementerian dan lembaga terkait untuk mengawasi harga pangan agar tetap di bawah het saat sampai ke konsumen.

budi gunawan menyebut, nantinya kementerian pertanian (kementan) akan menindak para pengusaha yang tidak mematuhi dan tidak menjalankan penjualan bahan pokok sesuai het.

bahkan, izin perusahaan yang melanggar ketentuan itu terancam disegel dan dibekukan oleh pemerintah.

""kami tidak menoleransi para pengusaha yang melanggar sehingga dapat merugikan masyarakat.

apalagi saat bulan puasa nanti, pemerintah berharap situasi keamanan kondusif dan masyarakat bisa menjalankan ibadah puasa dengan tenang,"" ujar budi.

ia selanjutnya mengimbau masyarakat untuk dapat melaporkan pihak-pihak yang terbukti menjual bahan pokok yang tidak sesuai dengan het.

sebelumnya, menteri pertanian (mentan) andi amran sulaiman menegaskan bahwa pemerintah tak akan ambil kompromi terkait kepatuhan para pengusaha untuk menjual bahan pangan sesuai het yang telah ditetapkan.

menurut mentan, pada tahun sebelumnya ada pedagang yang menjual di atas het.

""tahun ini arahan bapak presiden, tidak boleh menjulan di atas het.

kemudian yang kedua, operasi pasar dilakukan di seluruh wilayah indonesia, bukan saja di jakarta,"" kata amran dalam konferensi pers di kantor pusat kementerian pertanian, di jakarta selatan, rabu (19/2/2025).

view this post on instagram"
https://khazanah.republika.co.id/berita/ss2lhu458/jelang-ramadhan-menko-polkam-jamin-harga-pangan-stabil,khazanah.republika.co.id,"Jelang Ramadhan, Menko Polkam Jamin Harga Pangan Stabil |Republika Online",2025-02-22,"menjelang ramadhan 1446 h, pemerintah memastikan pengendalian harga pangan utama.

menteri koordinator bidang politik dan keamanan (menko polkam) budi gunawan mengatakan, seluruh kementerian akan berkolaborasi tidak hanya untuk mengawasi harga pangan di pasaran, tetapi juga menggelar operasi pasar di tengah masyarakat.

menurut dia, hal itu dilakukan pula selama bulan puasa hingga hari raya idul fitri 1446 h.

""sehingga masyarakat tetap mendapatkan harga di bawah het (harga eceran tertinggi), seperti yang disampaikan bapak presiden prabowo subianto,"" kata menko polkam budi gunawan dalam keterangan pers, sabtu (22/2/2025).

sebagai contoh, untuk minyak goreng minyakita, pemerintah telah menetapkan het sebesar rp 15.700 per liter.

menko polkam mengakui, kini angka realisasi jual produk tersebut sebesar rp17.500 atau melebihi het.

oleh karena itu, lanjut dia, presiden prabowo subianto telah memerintahkan kementerian dan lembaga terkait untuk mengawasi harga pangan agar tetap di bawah het saat sampai ke konsumen.

budi gunawan menyebut, nantinya kementerian pertanian (kementan) akan menindak para pengusaha yang tidak mematuhi dan tidak menjalankan penjualan bahan pokok sesuai het.

bahkan, izin perusahaan yang melanggar ketentuan itu terancam disegel dan dibekukan oleh pemerintah.

""kami tidak menoleransi para pengusaha yang melanggar sehingga dapat merugikan masyarakat.

apalagi saat bulan puasa nanti, pemerintah berharap situasi keamanan kondusif dan masyarakat bisa menjalankan ibadah puasa dengan tenang,"" ujar budi.

ia selanjutnya mengimbau masyarakat untuk dapat melaporkan pihak-pihak yang terbukti menjual bahan pokok yang tidak sesuai dengan het.

sebelumnya, menteri pertanian (mentan) andi amran sulaiman menegaskan bahwa pemerintah tak akan ambil kompromi terkait kepatuhan para pengusaha untuk menjual bahan pangan sesuai het yang telah ditetapkan.

menurut mentan, pada tahun sebelumnya ada pedagang yang menjual di atas het.

""tahun ini arahan bapak presiden, tidak boleh menjulan di atas het.

kemudian yang kedua, operasi pasar dilakukan di seluruh wilayah indonesia, bukan saja di jakarta,"" kata amran dalam konferensi pers di kantor pusat kementerian pertanian, di jakarta selatan, rabu (19/2/2025).

view this post on instagram"
