url,domain,title,date,clean_text
https://ekonomi.republika.co.id/berita/ssumfe490/harga-cabai-meroket-ini-strategi-badan-pangan-turunkan-harga,ekonomi.republika.co.id,"Harga Cabai Meroket, Ini Strategi Badan Pangan Turunkan Harga |Republika Online",2025-03-09,"pemerintah berupaya menstabilkan harga cabai yang belakangan mengalami fluktuasi di beberapa daerah.

untuk mendukung upaya penstabilan itu, badan pangan nasional/national food agency (nfa) berkoordinasi secara simultan untuk mengadakan stabilisasi pasokan dan harga pangan (sphp) cabai.

bapanas bersama dinas pangan provinsi dan kabupaten/kota melaksanakan kegiatan gerakan pangan murah (gpm).

kemudian mendorong gerakan jual cabai harga petani yang digagas kementerian pertanian, agar turut merambah ke wilayah yang bukan sentra produksi komoditas tersebut.

""ini yang kita terus dorong untuk penstabilan cabai, terutama di lombok tengah dan mataram,"" kata kepala nfa, arief prasetyo adi dalam keterangannya di jakarta, dikutip ahad (9/3/2025).

berdasarkan data panel harga pangan, per 7 maret 2025, indeks harga cabai rawit merah telah berada 49,97 persen melebihi harga acuan penjualan (hap) di tingkat konsumen.

rerata harga secara nasional untuk cabai rawit merah berada di harga rp 85.482 per kilogram (kg).

""selain gpm, kita juga akan upayakan penstabilan cabai dengan program fasilitasi distribusi pangan (fdp).

ini karena pemerintah, baik pusat maupun daerah, harus hadir untuk masyarakat dapat membeli pangan pokok dengan harga baik.

jadi skema kerja sama antar daerah yang surplus dengan daerah yang sedang defisit bisa dengan fdp ini,"" ujar arief, menambahkan.

sepanjang tahun 2024 pemerintah bersama segenap stakeholder pangan telah melaksanakan fdp yang realisasinya total mencapai 750 ribu per kg.

dari itu, fdp cabai total terlaksana sebanyak 250 ribu per kg.

ini terdiri dari cabai merah besar 206,4 per kg; cabai merah keriting 38,7 ribu per kg; dan cabai rawit merah 4,9 ribu per kg.

sebagaimana yang tersampaikan dalam rakor sphp cabai pada rabu (5/3/2025), penyebab terjadinya fluktuasi harga cabai dikarenakan ketersediaan yang terbatas di lombok tengah dan bukan termasuk daerah sentra produksi cabai.

pasokan pun didatangkan dari lombok timur dengan harga rp 180.000 per kg.

sementara produksi cabai turut mengalami depresiasi akibat faktor musim hujan, sehingga terpaksa ada libur petik.

terlebih tidak semua petani cabai memiliki fasilitas green house, sehingga berpengaruh pada tumbuh kembang tanaman cabai.

""cabai itu kalau hujan, bunganya rontok, sehingga tidak bisa sampai berbuah.

pemerintah ke depannya akan lebih mendorong petani cabai bisa menerapkan cungkup atau green house-nya.

dengan terapan itu bisa membantu tanaman cabai sampai bisa dipanen 20 kali,"" ujar arief.

situasi di lapangan menunjukkan harga cabai melambung tinggi.

saat rapat kerja dengan komisi iv dpr ri, pada senin (3/3/2025), menteri perdagangan budi santoso mengakui harga cabai rawit menembus angka rp 100 ribu.

di daerah-daerah juga demikian.

teranyar, ketika mendatangi salah satu pasar rakyat di jakarta pusat, menteri koordinator bidang pangan, zulkifli hasan mendapati hal yang sama.

ia menanyakan langsung harga cabai rawit di pasar tersebut.

berdasarkan pengakuan pedagang-pedagang, harga komoditas tersebut juga di angka rp 100 ribuan.

sejumlah pembeli juga mengatakan hal yang sama.

bahkan ada yang mendapati harga cabai rawit per kilogram sekitar rp 110 ribu- rp 120 ribu.

pertanyaannya mengapa demikian?

di saat harga komoditas lain masih dalam batas wajar, cabai rawit mahal.

""ya, cabai mungkin karena musim hujan.

kalau musim hujan kan panennya gagal,"" kata menko zulhas, di pasar johar, jakpus, rabu (5/3/2025).

ia memprediksi situasi seperti ini tidak bertahan lama.

menurut zulhas, biasanya sekitar dua minggu sudah mengalami penurunan.

harga acuan penjualan yang ditetapkan pemerintah (hap) untuk komoditas cabai rawit antara rp 40 ribu-rp 57 ribu per kg.

""setelah nanti terang lagi, itu akan turun lagi.

itu kan memang kita kan masih pertaniannya, pertanian terbuka,"" ujar zulhas.

di berbagai daerah di indonesia sedang mengalami musim hujan.

keadaan demikian memengaruhi proses panen cabai.

ditambah lagi, sudah memasuki bulan ramadan.

menurut zulhas, saat ini, permintaan masyarakat akan komoditas tersebut berpotensi tinggi.

""cabai jadi primadona kalau puasa, apalagi nanti lebaran,"" kata menko pangan."
https://ekonomi.republika.co.id/berita/t56lnh502/emas-antam-naik-rp8000-simak-harga-terbaru-dan-pajak-yang-dikenakan,ekonomi.republika.co.id,Emas Antam Naik Rp8.000: Simak Harga Terbaru dan Pajak yang Dikenakan |Republika Online,2025-11-04,"harga emas antam yang dipantau dari laman logam mulia pada selasa (4/11) mengalami kenaikan rp8.000 dari sebelumnya rp2.278.000 per gram.

untuk harga jual kembali (buyback) turut naik ke angka rp2.151.000 dari sebelumnya rp2.143.000 per gram.

transaksi harga jual dikenakan potongan pajak, sesuai dengan pmk no.

34/pmk.10/2017.

penjualan kembali emas batangan ke pt antam tbk dengan nominal lebih dari rp10 juta, dikenakan pajak penghasilan (pph) pasal 22 sebesar 1,5 persen untuk pemegang nomor pokok wajib pajak (npwp) dan 3 persen untuk non-npwp.

pph 22 atas transaksi buyback dipotong langsung dari total nilai buyback.

berikut adalah harga pecahan emas batangan yang tercatat di laman logam mulia antam pada selasa: - harga emas 0,5 gram: rp1.193.000.

- harga emas 1 gram: rp2.286.000.

- harga emas 2 gram: rp4.512.000.

- harga emas 3 gram: rp6.743.000.

- harga emas 5 gram: rp11.205.000.

- harga emas 10 gram: rp22.355.000.

- harga emas 25 gram: rp55.762.000.

- harga emas 50 gram: rp111.445.000.

- harga emas 100 gram: rp222.812.000.

- harga emas 250 gram: rp556.765.000.

- harga emas 500 gram: rp1.113.320.000.

- harga emas 1.000 gram: rp2.226.600.000.

potongan pajak harga beli emas sesuai dengan pmk nomor 34/pmk.10/2017, di mana pembelian emas batangan dikenakan pph 22 sebesar 0,45 persen untuk pemegang npwp dan 0,9 persen untuk non-npwp.

setiap pembelian emas batangan disertai dengan bukti potong pph 22."
https://ekonomi.republika.co.id/berita/t5nb9u368/mentan-amran-harga-beras-di-pasar-legi-solo-stabil-dan-di-bawah-het,ekonomi.republika.co.id,Mentan Amran: Harga Beras di Pasar Legi Solo Stabil dan di Bawah HET |Republika Online,2025-11-13,"menteri pertanian andi amran sulaiman menegaskan harga beras di sejumlah daerah saat ini dalam kondisi stabil dan bahkan ada yang berada di bawah harga eceran tertinggi (het).

hal itu juga terpantau saat mentan melakukan inspeksi mendadak bersama wakil menteri pertanian, kepala bulog, dan jajaran pemerintah daerah, kamis (13/11/2025) di pasar legi, surakarta.

“alhamdulillah harga baik, stabil, itu kata pedagang di sini tadi.

namun ada beberapa pemberitaan yang menyatakan harga naik.

untuk itu hari ini kami turun ke lapangan bersama pak wamentan dan bulog.

ada tadi beras sphp harganya rp 12 ribu per kilo, ada juga premium rp 13 ribu.

het kita untuk premium rp 14.900 dan untuk medium rp 13.500.

artinya sesuai, bahkan di bawah het,” kata mentan amran.

ia juga mengingatkan agar isu harga pangan tidak dijadikan alat politik.

“jadi tolong untuk lebih berhati-hati memberikan pernyataan terkait harga.

kita harus jaga ini karena ini untuk rakyat kecil.

boleh berpolitik, tapi jangan dipolitisasi untuk sektor pangan,” kata dia.

kementerian pertanian memastikan akan terus turun langsung ke lapangan untuk memantau harga dan pasokan pangan agar tidak ada celah bagi oknum yang mencoba memanipulasi data dan opini publik.

stabilitas harga beras, kata mentan amran, bukan hasil kebetulan, tetapi kerja sama konkret antara pusat dan daerah serta dukungan penuh presiden prabowo subianto untuk menjaga ketahanan pangan nasional.

“beras adalah kebutuhan dasar rakyat.

tugas kami memastikan harganya stabil, petani untung, rakyat senang.

itu baru politik pangan yang sesungguhnya,” kata mentan amran.

wali kota surakarta, respati ardi menyampaikan pemerintah kota solo memiliki tim pengendali inflasi daerah yang aktif memantau harga kebutuhan pokok setiap hari.

“kami ada tim inflasi daerah, jadi kalau ada harga yang sedikit naik pasti akan diintervensi dan langsung kami koordinasikan dengan kementan dan bulog.

tapi hari ini situasinya sangat baik.

kalau ada harga yang tidak sesuai het, silakan dilaporkan,” ujarnya.

salah satu pedagang sembako di pasar legi, ibu srikati, mengaku harga beras saat ini tergolong stabil dan penjualan berjalan normal.

“harga stabil, beras juga gitu, rp 12 ribu sampai rp 13 ribu.

tidak ada kenaikan, malah sekarang pembeli makin ramai karena harga turun,” katanya sambil melayani pembeli."
https://ekonomi.republika.co.id/berita/t5n9yh370/harga-emas-antam-naik-rp29000-nyaris-rp24-juta-per-gram,ekonomi.republika.co.id,"Harga Emas Antam Naik Rp29.000, Nyaris Rp2,4 Juta per Gram |Republika Online",2025-11-13,"harga emas batangan produksi pt aneka tambang tbk (antam) kembali menguat pada awal perdagangan kamis (13/11/2025).

berdasarkan data dari laman resmi logam mulia, harga emas naik rp29.000 per gram, dari sebelumnya rp2.367.000 menjadi rp2.396.000 per gram.

sementara itu, harga jual kembali (buyback) juga tercatat meningkat, berada di level rp2.261.000 per gram.

kenaikan ini melanjutkan tren positif harga emas dalam dua pekan terakhir, seiring menguatnya permintaan investor terhadap aset lindung nilai di tengah ketidakpastian ekonomi global.

transaksi harga jual emas batangan tetap dikenakan potongan pajak sesuai peraturan menteri keuangan (pmk) no.

34/pmk.10/2017.

untuk penjualan kembali emas batangan ke pt antam tbk dengan nominal di atas rp10 juta, dikenakan pajak penghasilan (pph) pasal 22 sebesar 1,5 persen bagi pemegang npwp dan 3 persen untuk non-npwp.

potongan pajak tersebut dipotong langsung dari total nilai buyback.

berikut daftar lengkap harga emas batangan antam pada kamis (13/11): - 0,5 gram: rp1.248.000 - 1 gram: rp2.396.000 - 2 gram: rp4.732.000 - 3 gram: rp7.073.000 - 5 gram: rp11.755.000 - 10 gram: rp23.455.000 - 25 gram: rp58.512.000 - 50 gram: rp116.945.000 - 100 gram: rp233.812.000 - 250 gram: rp584.265.000 - 500 gram: rp1.168.320.000 - 1.000 gram: rp2.336.600.000 sementara itu, pembelian emas batangan juga dikenakan pph 22 sebesar 0,45 persen untuk pemegang npwp dan 0,9 persen untuk non-npwp.

setiap transaksi pembelian akan disertai dengan bukti potong pajak sebagai bukti pembayaran resmi.

kenaikan harga emas antam kali ini dipengaruhi oleh faktor eksternal, seperti pelemahan dolar amerika serikat (as) dan ketegangan geopolitik di beberapa kawasan yang mendorong investor beralih ke aset aman (safe haven).

selain itu, ekspektasi pasar terhadap kebijakan suku bunga global yang cenderung menurun turut mendukung penguatan harga logam mulia."
https://ekonomi.republika.co.id/berita/sqf2p6370/harga-emas-antam-naik-jadi-rp-1591-juta-per-gram,ekonomi.republika.co.id,"Harga Emas Antam Naik Jadi Rp 1,591 Juta per Gram |Republika Online",2025-01-21,"harga emas antam yang dipantau dari laman logam mulia selasa (21/1/2025), naik sebesar rp6.000 menjadi rp 1.591.000 per gram dari sebelumnya rp 1.585.000 per gram.

adapun harga jual kembali (buyback) emas batangan turut naik, yakni rp 1.437.000 per gram.

transaksi harga jual dikenakan potongan pajak, sesuai dengan pmk no.

34/pmk.10/2017.

penjualan kembali emas batangan ke pt antam tbk dengan nominal lebih dari rp10 juta, dikenakan pajak penghasilan (pph) pasal 22 sebesar 1,5 persen untuk pemegang nomor pokok wajib pajak (npwp) dan 3 persen untuk non-npwp.

pph 22 atas transaksi buyback dipotong langsung dari total nilai buyback.

berikut harga pecahan emas batangan yang tercatat di laman logam mulia antam pada selasa: - harga emas 0,5 gram: rp 845.500 - harga emas 1 gram: rp1.591.000 - harga emas 2 gram: rp 3.122.000 - harga emas 3 gram: rp 4.658.000 - harga emas 5 gram: rp 7.730.000 - harga emas 10 gram: rp 15.405.000 - harga emas 25 gram: rp 38.387.000 - harga emas 50 gram: rp 76.695.000 - harga emas 100 gram: rp 153.312.000 - harga emas 250 gram: rp 383.015.000 - harga emas 500 gram: rp 765.820.000 - harga emas 1.000 gram: rp 1.531.600.000 potongan pajak harga beli emas sesuai dengan pmk nomor 34/pmk.10/2017, pembelian emas batangan dikenakan pph 22 sebesar 0,45 persen untuk pemegang npwp dan 0,9 persen untuk non-npwp.

setiap pembelian emas batangan disertai dengan bukti potong pph 22."
https://ekonomi.republika.co.id/berita/t12ahp451/mentan-bocorkan-beras-premium-oplosan-ekstrem-banget,ekonomi.republika.co.id,Mentan Bocorkan Beras Premium Oplosan: Ekstrem Banget |Republika Online,2025-08-16,"menteri pertanian (mentan), andi amran sulaiman mengungkapkan dari 10 sampel beras premium medium yang diuji di tengah maraknya kasus beras oplosan, diperoleh hasil campuran beras patah (broken rice) mencapai 59 persen.

“aku bocorkan, ya.

kami ambil 10 (sampel), itu brokennya 30-59 persen,” ucap andi amran ketika ditemui di sela konferensi pers rancangan anggaran pendapatan dan belanja negara (rapbn) dan nota keuangan tahun anggaran 2026 di direktorat jenderal pajak, jakarta, jumat.

padahal, lanjut dia, untuk dikategorikan sebagai beras premium medium, persentase beras patah hanya boleh menyentuh 15 persen.

dengan demikian, kasus beras oplosan merugikan masyarakat yang membeli beras premium medium, sebab beras yang dibeli berada di bawah standar beras premium medium yang sudah ditentukan.

“ekstrem, kan?

ekstrem banget,” tutur amran.

sebelumnya, kementerian pertanian (kementan) mengungkap dugaan praktik kecurangan dalam perdagangan beras yang menyebabkan kerugian konsumen hingga rp99,35 triliun akibat manipulasi kualitas dan harga di tingkat distribusi.

mentan pada rabu (30/7) mengungkapkan bahwa sebanyak 212 merek beras premium dan medium yang sempat beredar di pasaran terbukti tidak memenuhi ketentuan yang ditetapkan pemerintah, serta menyebut akan menindak tegas peredaran beras tersebut.

amran juga menyebut penindakan beras oplosan mendorong struktur pasar baru yang lebih sehat dimana konsumen lebih memilih pasar tradisional dan penggilingan gabah rakyat mendapatkan ruang usaha lebih luas.

menurutnya, penindakan beras oplosan tidak hanya menjaga kualitas beras, tetapi juga mengubah pola distribusi dan perilaku belanja masyarakat.

kini konsumen lebih percaya pasar tradisional, karena harga lebih murah, transparan, dan terbuka.

amran mencontohkan harga beras premium di pasar atau ritel modern berada pada kisaran rp17.000-rp18.000 per kilogram, sementara di pasar tradisional harga beras premium sekitar rp13.000 per kilogram."
https://rejabar.republika.co.id/berita/t0gyum512/jaga-stabilitas-harga-beras-bulog-cabang-bandung-mulai-salurkan-beras-sphp,rejabar.republika.co.id,"Jaga Stabilitas Harga Beras, Bulog Cabang Bandung Mulai Salurkan Beras SPHP |Republika Online",2025-08-04,"untuk menjaga stabilitas pasokan dan harga pangan, khususnya beras, perum bulog kantor cabang bandung telah menyalurkan beras stabilisasi pasokan dan harga pangan (sphp) langsung ke tingkat konsumen.

langkah ini, diambil sebagai respon terhadap kenaikan harga beras yang terjadi di sejumlah wilayah provinsi jawa barat (jabar).

sebagai langkah awal program sphp dilaksanakan melalui kegiatan operasi pangan murah yang dilaksanakan di kantor dan gudang bulog di wilayah bandung raya.

kegiatan ini tidak hanya untuk memastikan keterjangkauan harga oleh masyarakat, tetapi juga sebagai bagian dari upaya konkret mendukung pengendalian inflasi pangan dan menjaga daya beli masyarakat.

“kami terus berupaya hadir di tengah masyarakat, terutama saat harga kebutuhan pokok mengalami tekanan.

penugasan sphp ini bukan hanya soal distribusi beras, tapi juga bentuk nyata peran bulog sebagai stabilisator harga dan penyedia pangan yang terpercaya,” ujar pemimpin perum bulog kantor cabang bandung, ashville nusa panata, senin (4/7/2025).

perum bulog, kata dia, secara nasional telah mendapatkan penugasan untuk melaksanakan penyaluran beras sphp menggunakan cadangan beras pemerintah (cbp) mulai dari 8 juli hingga 31 desember 2025.

seluruh penyaluran dilakukan dengan kemasan sphp berukuran 5 kg yang disebarkan melalui beragam jalur distribusi, agar dapat menjangkau sebanyak mungkin masyarakat secara langsung dan merata.

melalui strategi ini, kata dia, diharapkan ketersediaan beras berkualitas dengan harga terjangkau dapat benar-benar sampai ke tangan konsumen rumah tangga, bukan hanya berputar di jalur distribusi menengah ke atas.

menurutnya, bandung raya sebagai wilayah strategis dan padat penduduk menjadi salah satu pusat pelaksanaan kegiatan sphp.

perum bulog kancab bandung akan terus berkoordinasi dengan pemerintah daerah, mitra bumn, serta koperasi dan pelaku pasar untuk memperluas titik distribusi dan mempercepat penyaluran.

penugasan sphp ini, kata dia, merupakan bagian dari langkah strategis pemerintah dalam memperkuat ketahanan pangan nasional, terutama menjelang akhir tahun yang seringkali diwarnai dengan tekanan harga.

bulog, melalui jaringan kerja di seluruh indonesia, termasuk bandung, berperan penting sebagai shock absorber pasar beras melalui penyediaan pasokan yang stabil dan harga yang terkendali.

berikut adalah jalur penyaluran resmi yang digunakan: - pengecer di pasar rakyat - pelaku usaha yang bukan distributor dan beroperasi di lingkungan pasar rakyat.

- koperasi desa/kelurahan merah putih.

- pemerintah daerah - melalui outlet binaan dan kegiatan gerakan pangan murah (gpm).

- bumn - seperti id food, pt pos indonesia, pt perkebunan nusantara, dan pupuk indonesia melalui jaringan outlet masing-masing.

- instansi pemerintah - termasuk kementerian, tni, polri, dan lembaga negara lainnya melalui koperasi atau outlet resmi serta kegiatan gpm.

- rpk (rumah pangan kita) perum bulog - mitra resmi distribusi ritel milik bulog.

- swalayan atau toko modern - yang menjual langsung ke konsumen dan tidak melakukan penjualan grosir."
https://ekonomi.republika.co.id/berita/stngnj370/harga-emas-melonjak-tinggi-indef-beri-rekomendasiini,ekonomi.republika.co.id,"Harga Emas Melonjak Tinggi, Indef Beri Rekomendasi Ini |Republika Online",2025-03-25,"harga emas terus melonjak tinggi, seiring dengan dinamika kondisi ekonomi dan geopolitik global.

center for sharia economic development institute for development of economics and finance (csed indef) mencatat, lonjakan harga emas dalam 54 tahun terakhir hampi mencapai 100 kali lipat, dengan kenaikan 39,40 persen antara maret 2024-maret 2025.

“kenaikan ini dipengaruhi oleh kondisi makro ekonomi dan ketegangan geopolitik global,” kata associate csed indef abdul hakam dalam diskusi ‘overview ekonomi ramadhan’ dikutip dalam keterangannya, senin (24/3/2025).

hakam berujar, emas memiliki peran strategis dalam ekonomi, termasuk meningkatkan tabungan masyarakat, mengurangi defisit perdagangan luar negeri, serta memperkuat likuiditas sistem keuangan.

ia kemudian mengungkapkan mengenai kebermanfaatan bank emas.

bank emas, menurutnya, dapat menjalankan berbagai kegiatan usaha seperti penyimpanan emas terstandardisasi, pembiayaan berbasis emas, perdagangan, serta penitipan dengan skema imbal hasil.

kendati demikian, ia juga mengingatkan bahwa risiko manipulasi pasar juga menjadi perhatian serius.

hal itu mengingat, misalnya, jp morgan pernah terbukti melakukan penipuan dan memanipulasi harga emas dan perak melalui praktik ‘spoofing’ di pasar global pada periode 2008-2016.

“oleh karena itu, pengawasan ketat dan berlapis terhadap bank emas sangat diperlukan agar dapat beroperasi dengan baik serta terhindari dari penyimpangan dan fraud,” ujarnya.

untuk mendorong stabilitas sistem keuangan, hakam merekomendasikan agar emas di indonesia, termasuk yang berbentuk digital, tetap harus memiliki bentuk fisik di bank.

di samping itu, bank emas juga disarankan untuk memprioritaskan minimal 50 persen pembiayaannya bagi usaha mikro, kecil, dan menengah (umkm), mengingat umkm menyerap 97 persen angkatan kerja nasional dan menyumbang 60 persen pdb.

adapun hingga desember 2024, pembiayaan perbankan syariah (bus dan uus) untuk umkm tercatat 16,64 persen, sementara bank umum sebesar 19,2 persen, mengutip data otoritas jasa keuangan/ojk, 2025.

“oleh karena itu, peran bank emas dalam mendukung sektor ini menjadi krusial,” terangnya.

selain itu, lanjut hakam, regulasi dalam peraturan ojk (pojk) nomor 17 tahun 2024 mengenai pembiayaan bank ema yang sebelumnya minimal 500 gram disarankan untuk diturunkan menjadi 50 gram.

juga pada batas minimum perdagangan emas yang sebelumnya 500 gram menjadi 10 gram agar lebih terjangkau bagi umkm dan masyarakat berpenghasilan rendah (mbr).

“dewan emas nasional tidak perlu berbentuk lembaga (bukan badan) non-struktural, atau bahkan tidak perlu dibentuk institusi baru, melainkan cukup menjadi forum koordinasi dan konsultasi antar pemangku kepentingan,“ ujar hakam.

""bank emas juga diharapkan mendapatkan jaminan dari lembaga penjamin simpanan (lps) guna meningkatkan kepercayaan publik.

selain itu, biaya penyelenggaraan ibadah haji sebaiknya berbasis standar emas untuk menjaga kestabilan nilai dan daya beli masyarakat dalam jangka panjang,"" lanjutnya."
https://ekonomi.republika.co.id/berita/svd0na490/mentan-jamin-harga-ayam-akan-kembali-normal-dalam-sepekan,ekonomi.republika.co.id,Mentan Jamin Harga Ayam akan Kembali Normal dalam Sepekan |Republika Online,2025-04-27,"menteri pertanian (mentan) andi amran sulaiman memastikan harga ayam hidup (livebird) di tingkat peternak segera kembali normal dalam waktu satu minggu ke depan di seluruh wilayah indonesia.

amran telah meminta direktur jenderal peternakan dan kesehatan hewan (pkh) kementan agung suganda untuk terus memantau harga ayam di tingkat peternak dan pasar setiap hari agar kondisi segera stabil.

""kami sudah minta dirjen pkh (peternakan dan kesehatan hewan), hampir tiap hari.

kami monitor, tadi sudah ada mulai naik,"" kata mentan ditemui di sela rapat koordinasi nasional bersama 37 ribu penyuluh pertanian yang dilakukan secara hybrid di jakarta, sabtu (26/4/2025).

menurut amran, laporan terakhir menunjukkan adanya tanda-tanda kenaikan harga ayam, dan para pihak yang terkait telah berjanji akan menormalkan harga maksimal dalam waktu satu minggu ke depan.

ia menegaskan apabila dalam satu minggu harga belum juga normal, dirinya secara langsung akan turun tangan untuk mengatasi masalah tersebut bersama jajaran di lapangan.

""kami janji satu minggu sudah normal kembali.

bila satu minggu tidak normal, aku yang turun tangan,"" tegas mentan.

ia juga mengingatkan bahwa peternak kecil tidak boleh dibiarkan berjuang sendiri dan meminta seluruh direktur terkait di kementerian pertanian untuk turut aktif membantu peternak.

""iya, itu janjinya kedua belah pihak.

kami minta, itu peternak kecil jangan dibiarkan jalan sendiri.

aku minta dirjen, direktur turun tangan semua,"" ucapnya.

menurut dia, kondisi turunnya harga ayam disebabkan tingginya produksi, sehingga salah satu solusi jangka panjang adalah dengan memperluas pasar ekspor produk unggas nasional.

""ya, memang produksi kita tinggi.

makanya, solusinya adalah ekspor.

telur kemarin sudah mulai ke beberapa negara.

ada 40 kontainer kalau tidak salah dilaporkan akan ekspor.

mungkin sudah diekspor,"" ucap mentan.

sebelumnya, kementerian pertanian mendorong industri pakan dan pelaku usaha rantai pasok perunggasan menyerap ayam hidup (livebird) dari peternak rakyat guna menjaga keberlanjutan usaha dan menstabilkan harga ayam di tingkat produsen.

""langkah ini penting untuk menjaga keberlanjutan usaha peternakan unggas sekaligus menstabilkan harga ayam di tingkat produsen,"" kata direktur jenderal peternakan dan kesehatan hewan kementan agung suganda dalam rapat koordinasi dukungan pakan terhadap stabilisasi harga livebird sebagaimana keterangan dikonfirmasi di jakarta, jumat (25/4/2025).

menurut agung, upaya stabilisasi harga livebird membutuhkan gotong royong lintas sektor, terutama dari perusahaan pakan, pabrik pakan non-budidaya dan pedagang bahan baku pakan.

sementara itu, berdasarkan data dari panel harga badan pangan nasional di lansir di jakarta, sabtu (26/4) pukul 20.30 wib, rata-rata harga ayam ras pedaging hidup di tingkat peternak mencapai rp19.565 per kg naik dari hari sebelumnya rp 19.212 per kg."
https://ekonomi.republika.co.id/berita/t290ef423/harga-emas-antam-senin-ini-stabil-rp206-juta-per-gram,ekonomi.republika.co.id,"Harga Emas Antam Senin Ini Stabil Rp2,06 Juta per Gram |Republika Online",2025-09-08,"harga emas antam yang dipantau dari laman logam mulia, senin (8/9/2025), stabil di angka rp2.060.000 per gram, dengan harga jual kembali (buyback) sebesar rp1.907.000 per gram.

transaksi harga jual dikenakan potongan pajak sesuai dengan peraturan menteri keuangan (pmk) nomor 34/pmk.10/2017.

penjualan kembali emas batangan ke pt antam tbk dengan nominal lebih dari rp10 juta dikenakan pajak penghasilan (pph) pasal 22 sebesar 1,5 persen bagi pemegang nomor pokok wajib pajak (npwp) dan 3 persen bagi non-npwp.

pph 22 atas transaksi buyback dipotong langsung dari total nilai buyback.

berikut harga pecahan emas batangan yang tercatat di laman logam mulia antam pada senin: - emas 0,5 gram: rp1.080.000 - emas 1 gram: rp2.060.000 - emas 2 gram: rp4.060.000 - emas 3 gram: rp6.065.000 - emas 5 gram: rp10.075.000 - emas 10 gram: rp20.095.000 - emas 25 gram: rp50.112.000 - emas 50 gram: rp100.145.000 - emas 100 gram: rp200.212.000 - emas 250 gram: rp500.265.000 - emas 500 gram: rp1.000.320.000 - emas 1.000 gram: rp2.000.600.000 sementara itu, potongan pajak pembelian emas sesuai dengan pmk nomor 34/pmk.10/2017 dikenakan pph 22 sebesar 0,45 persen bagi pemegang npwp dan 0,9 persen bagi non-npwp.

setiap pembelian emas batangan disertai bukti potong pph 22."
