url,domain,title,date,clean_text
https://ekonomi.republika.co.id/berita/sw4mq0490/pln-beri-diskon-tambah-daya-50-persen-ini-caranya,ekonomi.republika.co.id,"PLN Beri Diskon Tambah Daya 50 Persen, Ini Caranya |Republika Online",2025-05-12,"pt pln (persero) menghadirkan promo tambah daya listrik dengan potongan biaya sebesar 50 persen dalam rangka memperingati hari kebangkitan nasional.

promo ini berlaku pada periode 10-23 mei 2025.

“mengusung semangat hari kebangkitan nasional, program promo tambah daya bangkit lebih terang dihadirkan untuk memberikan pengalaman penggunaan listrik yang lebih nyaman melalui kemudahan tambah daya,” ujar direktur retail dan niaga pln, edi sri mulyanti di jakarta, senin (12/5/2025).

program bertajuk bangkit lebih terang ini diperuntukkan bagi pelanggan tegangan rendah seluruh golongan tarif satu fasa, dengan daya awal 450 volt ampere (va) hingga 5.500 va yang ingin melakukan tambah daya hingga batas maksimal 7.700 va.

program ini hanya dapat diikuti oleh pelanggan pln yang sudah terdaftar sebelum 1 mei 2024.

edi menyampaikan bahwa program ini merupakan bentuk apresiasi pln kepada pelanggan setia, sekaligus dukungan pln bagi masyarakat dalam memenuhi kebutuhan listrik untuk berbagai aktivitas dengan biaya yang lebih terjangkau.

diskon tambah daya 50 persen ini dapat diperoleh dengan melakukan transaksi kelistrikan melalui aplikasi pln mobile.

bagi pelanggan prabayar, cukup melakukan pembelian token, sedangkan pelanggan pascabayar dapat melakukan pembayaran tagihan listrik.

setelah transaksi berhasil, pelanggan akan menerima e-voucher diskon tambah daya yang dapat diakses melalui fitur reward di aplikasi pln mobile atau melalui email pelanggan yang terdaftar.

selanjutnya, pelanggan dapat mengajukan permohonan tambah daya melalui aplikasi pln mobile dengan memasukkan kode e-voucher yang diterima.

setelah pembayaran terkonfirmasi, unit pln setempat akan segera memproses penambahan daya sesuai ketentuan yang berlaku.

melalui promo ini, pelanggan dapat menghemat lebih dari rp 3 juta.

sebagai contoh, pelanggan dengan daya 450 va yang ingin meningkatkan daya ke 7.700 va hanya perlu membayar rp 3.512.625, dibandingkan dengan biaya sebelumnya yang mencapai rp 7.025.250.

sebagai informasi tambahan, satu akun pln mobile hanya dapat menerima maksimal empat e-voucher selama masa promo berlangsung.

hal ini bertujuan memberikan kesempatan merata kepada lebih banyak pelanggan.

“prosesnya mudah dan cepat.

semua dilakukan melalui pln mobile.

kami berharap masyarakat bisa memanfaatkan kesempatan ini sebaik-baiknya sebelum program berakhir pada 23 mei 2025,” kata edi."
https://news.republika.co.id/berita/svsip0451/soal-pangan-prabowo-pemerintah-berhasil-jaga-stabilitas-harga-aman-stok-tersedia,news.republika.co.id,"Soal Pangan, Prabowo: Pemerintah Berhasil Jaga Stabilitas, Harga Aman, Stok Tersedia |Republika Online",2025-05-05,"presiden ri prabowo subianto menyatakan bahwa pemerintah berhasil menjaga stabilitas harga pangan pada momen-momen yang biasanya rentan terhadap kenaikan harga, seperti akhir tahun, natal, dan lebaran.

""pemerintah yang saya pimpin, saudara-saudara, berhasil menjaga stabilitas harga pangan di saat-saat yang selalu harga pangan kurang bisa dikendalikan, akhir tahun, natal, dan lebaran,"" ujar prabowo saat memimpin sidang kabinet paripurna terkait enam bulan pemerintahan kabinet merah putih, di istana kepresidenan, jakarta, senin.

menurutnya, stok pangan tetap tersedia dan harga terkendali berkat kerja keras para jajaran menteri kabinet merah putih di lapangan.

prabowo juga menceritakan pengalamannya sebagai anak dari mantan menteri perdagangan soemitro djojohadikusumo yang pernah menghadapi tantangan serupa dalam menjaga pasokan pangan.

dia bercerita tentang bagaimana pada masa lalu, pemerintah harus turun tangan secara langsung, termasuk menunggu kapal di dermaga, untuk memastikan ketersediaan bahan pokok.

""pemerintah waktu itu mau intervensi karena krisis pangan harga-harga juga menjulang, sehingga pemerintah intervensi, pemerintah bertindak menjamin di hari-hari kritis bahan-bahan tersedia,"" kata presiden.

menurutnya, keberhasilan saat ini menunjukkan bahwa pemerintah mampu bertindak efektif dalam menjamin stabilitas pangan, terutama di hari-hari kritis yang sering memicu gejolak harga.

""di masa pemerintahan kita, harga aman, stok tersedia.

ini pekerjaan saudara-saudara sekalian, yang di lapangan kalian, yang mengecek harga kalian,"" kata kepala negara."
https://ekonomi.republika.co.id/berita/szh3d5451/pemerintah-salurkan-13-ton-beras-murah-bagi-warga-di-aceh-jaya,ekonomi.republika.co.id,Pemerintah Salurkan 13 Ton Beras Murah bagi Warga di Aceh Jaya |Republika Online,2025-07-16,"pemerintah kabupaten (pemkab) aceh jaya melalui dinas kelautan, perikanan dan pangan (dkpp) setempat bekerjasama dengan perum bulog kantor cabang meulaboh menyalurkan 13 ton beras murah untuk warga daerah ini dalam rangka menjaga kestabilan harga beras.

""kegiatan ini bukan hanya bertujuan untuk menekan harga, tetapi juga untuk memperkuat daya beli masyarakat,"" kata kepala dkpp aceh jaya teuku ridwan, di aceh jaya, aceh, selasa.

penyaluran beras murah tersebut dilaksanakan melalui kegiatan gerakan pangan murah (gpm).

langkah ini dilakukan karena adanya kenaikan harga beras di pasaran yang telah melampaui harga eceran tertinggi (het).

khususnya di aceh jaya, harga beras medium saat ini mencapai rp15 ribu per kilogram, atau berada di atas het rp13.100 per kilogram sesuai peraturan badan pangan nasional nomor 5 tahun 2024.

""kegiatan ini juga merupakan bagian dari program stabilisasi pasokan dan harga pangan (sphp) yang dilaksanakan sebagai respons atas melonjaknya harga beras di atas het,"" ujarnya.

teuku ridwan menjelaskan, 13 ton beras sphp tersebut disalurkan secara bertahap melalui gpm pada empat wilayah di aceh jaya, yakni selasa (15/7) di kecamatan jaya, rabu (16/7) di teunom, kamis (17/7) di panga, dan jumat (18/7) di kecamatan krueng sabee.

dirinya berharap masyarakat dapat memanfaatkan kegiatan pangan murah ini untuk mendapatkan beras berkualitas dengan harga terjangkau.

“gpm ini menjadi langkah nyata pemerintah daerah dalam menjamin keterjangkauan pangan, terutama bagi masyarakat miskin dan rentan pangan di aceh jaya,” katanya lagi.

dia menambahkan, pelaksanaan gpm di berbagai titik strategis kecamatan dipilih, agar mudah diakses masyarakat, sekaligus menjadi sarana edukasi pentingnya ketahanan pangan lokal.

“kami berharap gpm ini dapat menjadi tolok ukur keberlanjutan program pangan murah dan menjadi bagian dari visi besar menuju kedaulatan pangan, sebagaimana tagline kami: pangan kuat, masyarakat berdaulat,” demikian teuku ridwan."
https://tv.republika.co.id/berita/sze70p526/kata-pedagang-beras-cipinang-soal-beras-premium-oplosan,tv.republika.co.id,Kata Pedagang Beras Cipinang Soal Beras Premium Oplosan |Republika Online,2025-07-14,"senin 14 jul 2025 21:02 wib rep: alfian/ red: edward republika.co.id, jakarta - polemik soal dugaan peredaran beras oplosan kembali mencuat setelah pemerintah memeriksa 212 merek beras yang dianggap melanggar ketentuan mutu.

pedagang yang ditemui republika mengungkapkan akar dari kejadian tersebut.

""menurut saya kalau saat ini beras oplosan itu kayaknya nggak mungkin.

beras oplosan itu biasanya yang dioplos dengan beras subsidi dari pemerintah.

sementara untuk saat ini pemerintah nggak keluarin beras subsidi.

operasi pasar, sphp, belum,"" kata salah satu penjual beras haryanto (45 tahun) saat ditemui republika di pasar induk beras cipinang, jakarta timur, senin (14/7/2025).

""itu sebenarnya kerja sudah istilahnya pahit-pahitan ya.

dari istilahnya nurunin kualitas biar bisa harganya nutup,"" katanya.

menurutnya sejumlah produsen terpaksa melakukan hal itu karena tidak bisa mengimbangi harga het beras.

dia katakan, istilah “oplosan” terlalu berlebihan dan menimbulkan kesan negatif, padahal upaya menurunkan mutu dilakukan agar harga jual tetap masuk akal.

ia juga mengatakan hal itu merugikan pedagang karena masyarakat menjadi was-was kendati hingga kini belum ada pengaruh kepada daya beli.

saat ini, harga gabah kering panen (gkp) disebut sudah menembus rp 7.000 per kilogram meskipun pemerintah menyebut harga gkp rp 6.500/kg.

harga itu dianggap sebagai imbas dari kebijakan pemerintah yang menyerap gabah lokal untuk cadangan beras nasional, menggantikan praktik impor di tahun-tahun sebelumnya.

“yang bikin susah sekarang, kita masih diatur pakai het (harga eceran tertinggi) lama, tapi biaya produksinya naik terus,” katanya."
https://ekonomi.republika.co.id/berita/t2ejse423/harga-emas-antam-kamis-kembali-meroket-jadi-rp2095-juta-per-gram,ekonomi.republika.co.id,"Harga Emas Antam Kamis Kembali Meroket Jadi Rp2,095 Juta per Gram |Republika Online",2025-09-11,"harga emas antam yang dipantau dari laman logam mulia, kamis (11/9/2025), naik rp21.000 dari sebelumnya rp2.074.000 menjadi rp2.095.000 per gram.

untuk harga jual kembali (buyback), ditetapkan sebesar rp1.942.000 per gram.

transaksi harga jual emas dikenakan potongan pajak sesuai peraturan menteri keuangan (pmk) nomor 34/pmk.10/2017.

penjualan kembali emas batangan ke pt antam tbk dengan nominal lebih dari rp10 juta dikenakan pajak penghasilan (pph) pasal 22 sebesar 1,5 persen bagi pemegang nomor pokok wajib pajak (npwp), dan 3 persen bagi non-npwp.

pph 22 atas transaksi buyback dipotong langsung dari total nilai buyback.

berikut rincian harga pecahan emas batangan antam yang tercatat di laman logam mulia pada kamis (11/9/2025): - emas 0,5 gram: rp1.097.500 - emas 1 gram: rp2.095.000 - emas 2 gram: rp4.130.000 - emas 3 gram: rp6.170.000 - emas 5 gram: rp10.250.000 - emas 10 gram: rp20.445.000 - emas 25 gram: rp50.987.000 - emas 50 gram: rp101.895.000 - emas 100 gram: rp203.712.000 - emas 250 gram: rp509.015.000 - emas 500 gram: rp1.017.820.000 - emas 1.000 gram: rp2.035.600.000 sementara itu, untuk pembelian emas batangan, sesuai pmk nomor 34/pmk.10/2017, dikenakan pph 22 sebesar 0,45 persen bagi pemegang npwp, dan 0,9 persen bagi non-npwp.

setiap pembelian emas batangan disertai dengan bukti potong pph 22."
https://ekonomi.republika.co.id/berita/t3have370/update-harga-emas-pegadaian-antam-ubs-dan-galeri24-kompak-menguat,ekonomi.republika.co.id,"Update Harga Emas Pegadaian: Antam, UBS, dan Galeri24 Kompak Menguat |Republika Online",2025-10-02,"harga emas yang dikutip dari laman resmi sahabat pegadaian, rabu (2/10/2025), menunjukkan pergerakan harga logam mulia produksi ubs, galeri24, dan antam.

harga jual emas antam naik tipis rp3.000 per gram menjadi rp2.338.000 dari sebelumnya rp2.335.000 per gram.

emas galeri24 tercatat naik rp17.000 per gram ke level rp2.242.000 dari rp2.225.000 per gram.

sementara itu, emas ubs mengalami lonjakan tertinggi, naik rp48.000 per gram menjadi rp2.283.000 dari harga sebelumnya rp2.235.000 per gram.

produk emas galeri24 dijual dengan variasi 0,5 gram hingga 1.000 gram, sementara emas ubs tersedia mulai 0,5 gram hingga 500 gram.

berikut daftar harga lengkap: harga emas ubs.

- 0,5 gram: rp1.235.00 - 1 gram: rp2.283.000 - 2 gram: rp4.531.000 - 5 gram: rp11.195.000 - 10 gram: rp22.271.000 - 25 gram: rp55.568.000 - 50 gram: rp110.905.000 - 100 gram: rp221.724.000 - 250 gram: rp554.145.000 - 500 gram: rp1.106.986.000 harga emas galeri24 - 0,5 gram: rp1.176.000 - 1 gram: rp2.242.000 - 2 gram: rp4.417.000 - 5 gram: rp10.962.000 - 10 gram: rp21.866.000 - 25 gram: rp54.528.000 - 50 gram: rp108.971.000 - 100 gram: rp217.833.000 - 250 gram: rp544.314.000 - 500 gram: rp1.088.092.000 - 1.000 gram: rp2.176.184.000 harga emas antam - 0,5 gram: rp1.222.000 - 1 gram: rp2.338.000 - 2 gram: rp4.613.000 - 3 gram: rp6.893.000 - 5 gram: rp11.454.000 - 10 gram: rp22.849.000 - 25 gram: rp56.992.000 - 50 gram: rp113.900.000 - 100 gram: rp227.719.000 - 250 gram: rp569.019.000 - 500 gram: rp1.137.817.000 - 1.000 gram: rp2.275.592.000"
https://ekonomi.republika.co.id/berita/t49953370/pecah-rekor-harga-emas-antam-melonjak-rp78-ribu-per-gram,ekonomi.republika.co.id,"Pecah Rekor, Harga Emas Antam Melonjak Rp78 Ribu per Gram |Republika Online",2025-10-17,"harga emas antam yang dipantau dari laman logam mulia, jumat (17/10/2025), terus mengalami kenaikan sejak 11 oktober 2025.

kini, harga emas tersebut meroket rp 78.000 dan dijual dengan harga rp 2.485.000 per gram dari sebelumnya rp 2.407.000 per gram.

untuk harga jual kembali (buyback) juga meningkat ke angka rp 2.334.000 per gram.

emas antam dijual mulai dari 0,5 gram hingga 1 kilogram (1.000 gram).

transaksi harga jual dikenakan potongan pajak sesuai dengan peraturan menteri keuangan (pmk) nomor 34/pmk.10/2017.

penjualan kembali emas batangan ke pt antam tbk dengan nominal lebih dari rp 10 juta dikenakan pajak penghasilan (pph) pasal 22 sebesar 1,5 persen bagi pemegang nomor pokok wajib pajak (npwp), dan 3 persen bagi yang tidak memiliki npwp.

pph 22 atas transaksi buyback dipotong langsung dari total nilai buyback.

berikut daftar harga pecahan emas batangan yang tercatat di laman logam mulia antam pada jumat: harga emas antam - 0,5 gram: rp 1.292.500 - 1 gram: rp 2.485.000 - 2 gram: rp 4.910.000 - 3 gram: rp 7.340.000 - 5 gram: rp 12.200.000 - 10 gram: rp 24.345.000 - 25 gram: rp 60.737.000 - 50 gram: rp 121.395.000 - 100 gram: rp 242.712.000 - 250 gram: rp 606.515.000 - 500 gram: rp 1.212.820.000 - 1.000 gram: rp 2.425.600.000 potongan pajak pembelian emas mengacu pada pmk nomor 34/pmk.10/2017.

pembelian emas batangan dikenakan pph 22 sebesar 0,45 persen bagi pemegang npwp dan 0,9 persen bagi non-npwp.

setiap pembelian emas batangan disertai dengan bukti potong pph 22."
https://ekonomi.republika.co.id/berita/t5pd6u370/harga-emas-dan-perak-melemah-kemendag-turunkan-hpe-konsentrat-tembaga,ekonomi.republika.co.id,"Harga Emas dan Perak Melemah, Kemendag Turunkan HPE Konsentrat Tembaga |Republika Online",2025-11-14,"kementerian perdagangan (kemendag) menetapkan penurunan harga patokan ekspor (hpe) konsentrat tembaga pada paruh kedua november 2025.

kebijakan ini menjadi respons atas melemahnya harga emas dan perak yang berdampak pada nilai rerata komoditas tersebut.

hpe rata-rata konsentrat tembaga untuk periode 15-30 november 2025 ditetapkan sebesar 5.432,58 dolar as per wet metrik ton (wmt), turun 0,54 persen dari paruh pertama november 2025 yang berada pada level 5.462,14 dolar as per wmt.

kemendag menyampaikan ketentuan ini melalui keputusan menteri perdagangan nomor 2175 tahun 2025 tentang hpe atas produk pertambangan yang dikenakan bea keluar.

regulasi tersebut ditetapkan pada 12 november 2025 dan menjadi dasar pelaksanaan kebijakan ekspor komoditas tambang bagi pelaku usaha.

penyesuaian nilai dilakukan mengikuti dinamika harga logam internasional dan kondisi pasar global yang terekam sepanjang awal november.

“nilai hpe konsentrat tembaga periode kedua november 2025 turun 0,54 persen dibanding paruh pertama november 2025.

penurunan dipengaruhi harga emas dan perak yang melemah,” ujar pelaksana tugas direktur jenderal perdagangan luar negeri kemendag tommy andana, di jakarta, dikutip jumat (14/11/2025).

ia menjelaskan penguatan dolar amerika serikat memberikan tekanan pada harga emas dan perak.

kondisi ini memicu penurunan rerata nilai konsentrat tembaga meskipun harga tembaga dunia sempat bergerak naik.

pergerakan logam mulia tersebut menjadi faktor dominan yang mempengaruhi penetapan nilai ekspor komoditas tambang pada periode berjalan."
https://ekonomi.republika.co.id/berita/svz4i7370/emas-antam-pada-9-mei-merosot-rp-27000-jadi-segini,ekonomi.republika.co.id,Emas Antam pada 9 Mei Merosot Rp 27.000 Jadi Segini |Republika Online,2025-05-09,"harga emas antam yang dipantau dari laman logam mulia mengalami penurunan sebesar rp 27.000 pada jumat (9/5/2025).

harga emas antam turun menjadi rp 1.926.000 dari semula rp 1.953.000 per gram.

adapun harga jual kembali (buyback) emas batangan turut turun ke angka rp 1.775.000 per gram.

transaksi harga jual dikenakan potongan pajak, sesuai dengan pmk no.

34/pmk.10/2017.

penjualan kembali emas batangan ke pt antam tbk dengan nominal lebih dari rp 10 juta, dikenakan pajak penghasilan (pph) pasal 22 sebesar 1,5 persen untuk pemegang nomor pokok wajib pajak (npwp) dan 3 persen untuk non-npwp.

pph 22 atas transaksi buyback dipotong langsung dari total nilai buyback.

berikut harga pecahan emas batangan yang tercatat di laman logam mulia antam pada jumat.

- harga emas 0,5 gram: rp 1.013.000 - harga emas 1 gram: rp 1.926.000 - harga emas 2 gram: rp 3.792.000 - harga emas 3 gram: rp 5.663.000 - harga emas 5 gram: rp 9.405.000.

- harga emas 10 gram: rp 18.755.000 - harga emas 25 gram: rp 46.762.000 - harga emas 50 gram: rp 93.445.000 - harga emas 100 gram: rp 186.812.000 - harga emas 250 gram: rp 466.765.000 - harga emas 500 gram: rp 933.320.000 - harga emas 1.000 gram: rp 1.866.600.000 potongan pajak harga beli emas sesuai dengan pmk nomor 34/pmk.10/2017, pembelian emas batangan dikenakan pph 22 sebesar 0,45 persen untuk pemegang npwp dan 0,9 persen untuk non-npwp.

setiap pembelian emas batangan disertai dengan bukti potong pph 22."
https://ekonomi.republika.co.id/berita/st3dh7490/harga-emas-makin-meroket-sekarang-sudah-rp-1742000-per-gram,ekonomi.republika.co.id,"Harga Emas Makin Meroket, Sekarang Sudah Rp 1.742.000 per Gram |Republika Online",2025-03-14,"harga emas antam yang dipantau dari laman logam mulia, jumat (14/3/2025), mengalami lonjakan sebesar rp 28.000, dari satu hari sebelumnya rp 1.714.000 menjadi rp 1.742.000 per gram.

adapun harga jual kembali (buyback) emas batangan turut melonjak menjadi rp 1.591.000 per gram.

transaksi harga jual dikenakan potongan pajak, sesuai dengan pmk no.

34/pmk.10/2017.

penjualan kembali emas batangan ke pt antam tbk dengan nominal lebih dari rp10 juta, dikenakan pajak penghasilan (pph) pasal 22 sebesar 1,5 persen untuk pemegang nomor pokok wajib pajak (npwp) dan 3 persen untuk non-npwp.

pph 22 atas transaksi buyback dipotong langsung dari total nilai buyback.

berikut harga pecahan emas batangan yang tercatat di laman logam mulia antam pada jumat (14/3/2025): - harga emas 0,5 gram: rp 921.000 - harga emas 1 gram: rp 1.742.000 - harga emas 2 gram: rp 3.424.000 - harga emas 3 gram: rp 5.111.000 - harga emas 5 gram: rp 8.485.000 - harga emas 10 gram: rp 16.915.000 - harga emas 25 gram: rp 42.162.000 - harga emas 50 gram: rp 84.245.000 - harga emas 100 gram: rp 168.412.000 - harga emas 250 gram: rp 413.765.000 - harga emas 500 gram: rp 420.765.000 - harga emas 1.000 gram: rp 1.682.600.000 potongan pajak harga beli emas sesuai dengan pmk nomor 34/pmk.10/2017, pembelian emas batangan dikenakan pph 22 sebesar 0,45 persen untuk pemegang npwp dan 0,9 persen untuk non-npwp.

setiap pembelian emas batangan disertai dengan bukti potong pph 22."
https://ekonomi.republika.co.id/berita/t1u1ro370/kemendagri-gerakan-pangan-murah-jaga-daya-beli-dan-kendalikan-inflasi,ekonomi.republika.co.id,Kemendagri: Gerakan Pangan Murah Jaga Daya Beli dan Kendalikan Inflasi |Republika Online,2025-08-31,"republika.co.id, menteri dalam negeri tito karnavian mengatakan program gerakan pangan murah (gpm) kementerian dalam negeri (kemendagri) bersama bulog, badan pangan nasional (bapanas), dan kementerian pertanian terbukti berhasil menekan gejolak harga beras di berbagai daerah.

pernyataan tersebut disampaikan tito dalam acara gpm serentak di kantor kementerian pertanian, jakarta.

“gerakan pangan murah terbukti efektif menjaga stabilitas harga beras.

penyaluran beras sphp benar-benar dirasakan manfaatnya oleh masyarakat,” ujar tito dalam keterangannya di jakarta, sabtu (30/8/2025).

tito menyampaikan, hingga akhir agustus 2025, beras sphp telah disalurkan ke 4.662 kecamatan dari total 7.285 kecamatan di indonesia.

penyaluran ini menjangkau lebih dari 3,4 juta masyarakat dengan kebutuhan sekitar 43 ribu ton beras.

hasilnya mulai terlihat nyata.

jika sebelumnya ada 233 kabupaten yang melaporkan kenaikan harga beras, kini jumlahnya menurun menjadi 200 kabupaten.

bahkan, 55 kabupaten melaporkan harga beras sudah kembali turun.

beras sphp merupakan stok dari cadangan beras pemerintah (cbp) dengan alokasi 1,3 juta ton untuk periode juli-desember 2025.

setiap kilogram beras dijual rp 12.000 atau rp 60.000 untuk kemasan 5 kg, jauh lebih murah dibanding harga pasaran.

bahkan, di beberapa daerah, harga bisa turun menjadi rp 11.000 per kg berkat dukungan subsidi dari kadin.

program ini juga mendapat dukungan penuh dari tni/polri, pemerintah daerah, serta bumd pangan agar distribusi merata hingga pelosok desa, kepulauan, dan wilayah pegunungan.

“dengan kolaborasi semua pihak, gpm bukan hanya menjaga daya beli masyarakat, tetapi juga mengendalikan inflasi nasional,” tegas tito.

keberhasilan gpm membuktikan kerja sama lintas sektor mampu memberikan solusi konkret dalam menghadapi kenaikan harga pangan, sekaligus menjamin masyarakat tetap bisa mengakses beras dengan harga terjangkau."
https://ekonomi.republika.co.id/berita/ssxu3l490/harga-emas-mulai-goyang-turun-rp-14-ribu-per-gram-hari-ini,ekonomi.republika.co.id,"Harga Emas Mulai Goyang, Turun Rp 14 Ribu per Gram Hari Ini |Republika Online",2025-03-11,"harga emas antam yang dipantau dari laman logam mulia, selasa (11/3/2025), mengalami penurunan sebesar rp 14.000 dari semula rp 1.693.000 menjadi rp 1.679.000 per gram.

adapun harga jual kembali (buyback) emas batangan turut mengalami penurunan, yakni ke angka rp 1.528.00 per gram.

transaksi harga jual dikenakan potongan pajak, sesuai dengan pmk no.

34/pmk.10/2017.

penjualan kembali emas batangan ke pt antam tbk dengan nominal lebih dari rp10 juta, dikenakan pajak penghasilan (pph) pasal 22 sebesar 1,5 persen untuk pemegang nomor pokok wajib pajak (npwp) dan 3 persen untuk non-npwp.

pph 22 atas transaksi buyback dipotong langsung dari total nilai buyback.

berikut harga pecahan emas batangan yang tercatat di laman logam mulia antam pada selasa (11/3/2025): - harga emas 0,5 gram: rp 889.500 - harga emas 1 gram: rp 1.679.000 - harga emas 2 gram: rp 3.298.000 - harga emas 3 gram: rp 4.922.000 - harga emas 5 gram: rp 8.170.000 - harga emas 10 gram: rp 16.285.000 - harga emas 25 gram: rp 40.587.000 - harga emas 50 gram: rp 81.095.000 - harga emas 100 gram: rp 162.112.000 - harga emas 250 gram: rp 405.015.000 - harga emas 500 gram: rp 809.820.000 - harga emas 1.000 gram: rp 1.619.600.000 potongan pajak harga beli emas sesuai dengan pmk nomor 34/pmk.10/2017, pembelian emas batangan dikenakan pph 22 sebesar 0,45 persen untuk pemegang npwp dan 0,9 persen untuk non-npwp.

setiap pembelian emas batangan disertai dengan bukti potong pph 22."
https://ekonomi.republika.co.id/berita/swaanx490/harga-emas-terus-merosot-apakah-ini-waktunya-beli,ekonomi.republika.co.id,"Harga Emas Terus Merosot, Apakah Ini Waktunya Beli? |Republika Online",2025-05-15,"harga emas dunia terus mengalami penurunan.

harga emas dunia di pasar spot pada perdagangan kamis (15/5/2025) pagi tercatat di angka 3.183,4 dolar as per troy ons atau berada di level terendah dalam satu bulan yang meninggalkan level psikologis 3.200 dolar as per troy ons sejak 9 april 2025.

sejalan dengan harga emas dunia, harga emas antam dalam laman logam mulia pun turut mengalami koreksi dengan turun sebesar rp 20 ribu.

harga emas antam per kamis (15/5/2025) tercatat rp 1.866.000 per gram atau turun dari sebelumnya yang sebesar rp 1.886.000 per gram.

""memang harga emas dunia ini turun.

itu pun juga berdampak terhadap penurunan harga logam mulia,"" ujar direktur pt trfx garuda berjangka ibrahim assuaibi kepada republika di jakarta, kamis (15/5/2025).

ibrahim menyampaikan penurunan harga emas dunia tak lepas dari meredanya tensi perang dagang antara amerika serikat (as) dengan cina melalui kesepakatan pemangkasan tarif impor sementara selama 90 hari.

ibrahim mengatakan cina hanya mengenakan tarif impor produk as sebesar 10 persen atau lebih rendah dari sebelumnya yang mencapai 125 persen, pun produk cina ke as dikenai tarif sebesar 30 persen dari sebelumnya yang mencapai 145 persen.

""perlu diingat 'gencatan senjata' perang dagang 90 hari, sementara, hanya tiga bulan.

setelah itu bakal naik lagi, 30 persen loh biaya impornya, cukup besar.

di periode pertama yang 10-25 persen saja begitu luar biasa terhadap ekonomi global, apalagi 30 persen,"" ucap ibrahim.

ibrahim memproyeksikan harga emas dunia akan berada di level 3.150 hingga 3.000 dolar as per troy ons.

ibrahim mengatakan masyarakat bisa menunggu harga emas antam mengalami koreksi jika hendak melakukan pembelian.

""mungkin harga logam mulia per gramnya itu bisa di rp 1.850.000 per gram, itu mungkin level yang paling bagus untuk melakukan pembelian,"" sambung ibrahim.

ibrahim menyebut harga emas dunia kemungkinan dapat kembali melonjak usai berakhirnya penetapan tarif impor sementara pada tiga bulan mendatang.

ibrahim memproyeksikan harga emas dunia bisa menuju level 3.700 dolar as saat gejolak perang dagang kembali memanas.

""para investor ini harus optimis harga emas dunia itu masih akan terus mengalami kenaikan.

kita masih optimistis harganya (emas antam) itu bakal ke rp 2.150.000 sampai rp 2.300.000 per gram,"" kata ibrahim."
